id	desc
KAG9391548.1	KAG9391548.1 Protein kinase domain [Carpediemonas membranifera]
KAG9391549.1	KAG9391549.1 hypothetical protein J8273_6314 [Carpediemonas membranifera]
KAG9391550.1	KAG9391550.1 DnaJ protein subfamily C member [Carpediemonas membranifera]
KAG9391551.1	KAG9391551.1 RNA recognition motif [Carpediemonas membranifera]
KAG9391552.1	KAG9391552.1 Hsp20/alpha crystallin family [Carpediemonas membranifera]
KAG9391553.1	KAG9391553.1 hypothetical protein J8273_6318 [Carpediemonas membranifera]
KAG9391554.1	KAG9391554.1 Inorganic pyrophosphatase [Carpediemonas membranifera]
KAG9391555.1	KAG9391555.1 Hsp20/alpha crystallin family protein [Carpediemonas membranifera]
KAG9391556.1	KAG9391556.1 hypothetical protein J8273_6321 [Carpediemonas membranifera]
KAG9391557.1	KAG9391557.1 Ankyrin repeats (3 copies) [Carpediemonas membranifera]
KAG9391558.1	KAG9391558.1 hypothetical protein J8273_6323 [Carpediemonas membranifera]
KAG9391559.1	KAG9391559.1 Eukaryotic translation initiation factor 3 subunit J [Carpediemonas membranifera]
KAG9391560.1	KAG9391560.1 hypothetical protein J8273_6325 [Carpediemonas membranifera]
KAG9391561.1	KAG9391561.1 NLI interacting factor-like phosphatase [Carpediemonas membranifera]
KAG9391562.1	KAG9391562.1 Endoplasmic reticulum oxidoreductin 1 [Carpediemonas membranifera]
KAG9391563.1	KAG9391563.1 hypothetical protein J8273_6328 [Carpediemonas membranifera]
KAG9391564.1	KAG9391564.1 Serine hydroxymethyltransferase [Carpediemonas membranifera]
KAG9391565.1	KAG9391565.1 TPR repeat region circular [Carpediemonas membranifera]
KAG9391566.1	KAG9391566.1 WD domain, G-beta repeat [Carpediemonas membranifera]
KAG9391567.1	KAG9391567.1 Fibrillarin [Carpediemonas membranifera]
KAG9391568.1	KAG9391568.1 Scramblase [Carpediemonas membranifera]
KAG9391569.1	KAG9391569.1 hypothetical protein J8273_6334 [Carpediemonas membranifera]
KAG9391570.1	KAG9391570.1 Histone-binding protein RBBP4 or subunit C of CAF1 complex [Carpediemonas membranifera]
KAG9391571.1	KAG9391571.1 hypothetical protein J8273_6336 [Carpediemonas membranifera]
KAG9391572.1	KAG9391572.1 Protein kinase domain [Carpediemonas membranifera]
KAG9391573.1	KAG9391573.1 Solute carrier (proton/amino acid symporter), TRAMD3 or PAT1 [Carpediemonas membranifera]
KAG9391574.1	KAG9391574.1 Arginine-tRNA ligase [Carpediemonas membranifera]
KAG9391575.1	KAG9391575.1 Acetyltransferase (GNAT) domain [Carpediemonas membranifera]
KAG9391576.1	KAG9391576.1 hypothetical protein J8273_6341 [Carpediemonas membranifera]
KAG9391577.1	KAG9391577.1 WD domain, G-beta repeat [Carpediemonas membranifera]
KAG9391578.1	KAG9391578.1 Integrin alpha beta-propellor repeat-containing protein [Carpediemonas membranifera]
KAG9391579.1	KAG9391579.1 hypothetical protein J8273_6344 [Carpediemonas membranifera]
KAG9391580.1	KAG9391580.1 hypothetical protein J8273_6345 [Carpediemonas membranifera]
KAG9391581.1	KAG9391581.1 serine/threonine-protein kinase WNK4 [Carpediemonas membranifera]
KAG9391582.1	KAG9391582.1 Protein kinase domain [Carpediemonas membranifera]
KAG9391583.1	KAG9391583.1 hypothetical protein J8273_6348 [Carpediemonas membranifera]
KAG9391584.1	KAG9391584.1 serine/threonine-protein kinase nek2 [Carpediemonas membranifera]
KAG9391585.1	KAG9391585.1 zinc finger protein [Carpediemonas membranifera]
KAG9391586.1	KAG9391586.1 hypothetical protein J8273_6351 [Carpediemonas membranifera]
KAG9391587.1	KAG9391587.1 Helicase conserved C-terminal domain [Carpediemonas membranifera]
KAG9391588.1	KAG9391588.1 Chromosome partition protein Smc [Carpediemonas membranifera]
KAG9391589.1	KAG9391589.1 protein of unknown function (DUF4457) [Carpediemonas membranifera]
KAG9391590.1	KAG9391590.1 Pep3/Vps18/deep orange family [Carpediemonas membranifera]
KAG9391591.1	KAG9391591.1 serine/threonine-protein kinase nek2 [Carpediemonas membranifera]
KAG9391592.1	KAG9391592.1 parkin coregulated gene protein [Carpediemonas membranifera]
KAG9391593.1	KAG9391593.1 ribosome biogenesis protein NSA2 [Carpediemonas membranifera]
KAG9391594.1	KAG9391594.1 Protein kinase domain [Carpediemonas membranifera]
KAG9391595.1	KAG9391595.1 Adaptor Protein Complex 3 subunit, beta (AP3B) [Carpediemonas membranifera]
KAG9391596.1	KAG9391596.1 Chromosome partition protein Smc [Carpediemonas membranifera]
KAG9391597.1	KAG9391597.1 Nin one binding (NOB1) Zn-ribbon like [Carpediemonas membranifera]
KAG9391598.1	KAG9391598.1 Sof1-like domain [Carpediemonas membranifera]
KAG9391599.1	KAG9391599.1 hypothetical protein J8273_6364 [Carpediemonas membranifera]
KAG9391600.1	KAG9391600.1 Ankyrin repeats (3 copies) [Carpediemonas membranifera]
KAG9391601.1	KAG9391601.1 hypothetical protein J8273_6366 [Carpediemonas membranifera]
KAG9391602.1	KAG9391602.1 OTU-like cysteine protease [Carpediemonas membranifera]
KAG9391603.1	KAG9391603.1 Kinesin motor domain [Carpediemonas membranifera]
KAG9391604.1	KAG9391604.1 Fanconi Anemia group J protein, FANCJ [Carpediemonas membranifera]
KAG9391605.1	KAG9391605.1 hypothetical protein J8273_6370 [Carpediemonas membranifera]
KAG9391606.1	KAG9391606.1 DnaJ domain [Carpediemonas membranifera]
KAG9391607.1	KAG9391607.1 Protein kinase domain [Carpediemonas membranifera]
KAG9391608.1	KAG9391608.1 Very-long-chain 3-ketoacyl-CoA synthase [Carpediemonas membranifera]
KAG9391609.1	KAG9391609.1 hypothetical protein J8273_6374 [Carpediemonas membranifera]
KAG9391610.1	KAG9391610.1 hypothetical protein J8273_6375 [Carpediemonas membranifera]
KAG9391611.1	KAG9391611.1 chromosome segregation protein [Carpediemonas membranifera]
KAG9391612.1	KAG9391612.1 hypothetical protein J8273_6377 [Carpediemonas membranifera]
KAG9391613.1	KAG9391613.1 hypothetical protein J8273_6378 [Carpediemonas membranifera]
KAG9391614.1	KAG9391614.1 hypothetical protein J8273_6379 [Carpediemonas membranifera]
KAG9391615.1	KAG9391615.1 tmcB-like protein [Carpediemonas membranifera]
KAG9391616.1	KAG9391616.1 EF-hand calcium-binding domain [Carpediemonas membranifera]
KAG9391617.1	KAG9391617.1 Protein kinase domain [Carpediemonas membranifera]
KAG9391618.1	KAG9391618.1 Protein kinase domain [Carpediemonas membranifera]
KAG9391619.1	KAG9391619.1 PTHB1 N-terminus [Carpediemonas membranifera]
KAG9391620.1	KAG9391620.1 hypothetical protein J8273_6385 [Carpediemonas membranifera]
KAG9391621.1	KAG9391621.1 Ribosomal protein S21e [Carpediemonas membranifera]
KAG9391622.1	KAG9391622.1 Ribosomal protein L15e [Carpediemonas membranifera]
KAG9391623.1	KAG9391623.1 Chaperonin Cpn60/TCP-1 [Carpediemonas membranifera]
KAG9391624.1	KAG9391624.1 hypothetical protein J8273_6389 [Carpediemonas membranifera]
KAG9391625.1	KAG9391625.1 hypothetical protein J8273_6390 [Carpediemonas membranifera]
KAG9391626.1	KAG9391626.1 Vacuolar-sorting protein SNF7 [Carpediemonas membranifera]
KAG9391627.1	KAG9391627.1 hypothetical protein J8273_6392 [Carpediemonas membranifera]
KAG9391628.1	KAG9391628.1 hypothetical protein J8273_6393 [Carpediemonas membranifera]
KAG9391629.1	KAG9391629.1 hypothetical protein J8273_6394 [Carpediemonas membranifera]
KAG9391630.1	KAG9391630.1 Ribosomal protein S30 [Carpediemonas membranifera]
KAG9391631.1	KAG9391631.1 Chaperonin Cpn60/TCP-1 [Carpediemonas membranifera]
KAG9391632.1	KAG9391632.1 WD domain, G-beta repeat [Carpediemonas membranifera]
KAG9391633.1	KAG9391633.1 hypothetical protein J8273_6398 [Carpediemonas membranifera]
KAG9391634.1	KAG9391634.1 hypothetical protein J8273_6399 [Carpediemonas membranifera]
KAG9391635.1	KAG9391635.1 NOT2 / NOT3 / NOT5 family [Carpediemonas membranifera]
KAG9391636.1	KAG9391636.1 Prefoldin alpha subunit [Carpediemonas membranifera]
KAG9391637.1	KAG9391637.1 Zinc finger, C3HC4 type (RING finger) [Carpediemonas membranifera]
KAG9391638.1	KAG9391638.1 Actin-related protein [Carpediemonas membranifera]
KAG9391639.1	KAG9391639.1 Inosine triphosphate pyrophosphatase-like [Carpediemonas membranifera]
KAG9391640.1	KAG9391640.1 FG-GAP repeat [Carpediemonas membranifera]
KAG9391641.1	KAG9391641.1 Chromosome partition protein Smc [Carpediemonas membranifera]
KAG9391642.1	KAG9391642.1 DEAD/DEAH box helicase [Carpediemonas membranifera]
KAG9391643.1	KAG9391643.1 hypothetical protein J8273_6408 [Carpediemonas membranifera]
KAG9391644.1	KAG9391644.1 Calcineurin-like phosphoesterase [Carpediemonas membranifera]
KAG9391645.1	KAG9391645.1 Tubulin [Carpediemonas membranifera]
KAG9391646.1	KAG9391646.1 SET domain [Carpediemonas membranifera]
KAG9391647.1	KAG9391647.1 Protein of unknown function DUF667 [Carpediemonas membranifera]
KAG9391648.1	KAG9391648.1 SRP54-type protein, GTPase domain [Carpediemonas membranifera]
KAG9391649.1	KAG9391649.1 Translation initiation factor 1A (eIF-1A) [Carpediemonas membranifera]
KAG9391650.1	KAG9391650.1 THO complex, subunit 5 [Carpediemonas membranifera]
KAG9391651.1	KAG9391651.1 Regulator of Vps4 activity in the MVB pathway [Carpediemonas membranifera]
KAG9391652.1	KAG9391652.1 hypothetical protein J8273_6417 [Carpediemonas membranifera]
KAG9391653.1	KAG9391653.1 Tetratricopeptide repeat [Carpediemonas membranifera]
KAG9391654.1	KAG9391654.1 Ribosomal protein L25/L23 [Carpediemonas membranifera]
KAG9391655.1	KAG9391655.1 hypothetical protein J8273_6420 [Carpediemonas membranifera]
KAG9391656.1	KAG9391656.1 Protein kinase domain [Carpediemonas membranifera]
KAG9391657.1	KAG9391657.1 hypothetical protein J8273_6422 [Carpediemonas membranifera]
KAG9391658.1	KAG9391658.1 Ribosomal protein L7, eukaryotic [Carpediemonas membranifera]
KAG9391659.1	KAG9391659.1 ATPase family associated with various cellular activities (AAA) [Carpediemonas membranifera]
KAG9391660.1	KAG9391660.1 hypothetical protein J8273_6425 [Carpediemonas membranifera]
KAG9391661.1	KAG9391661.1 hypothetical protein J8273_6426 [Carpediemonas membranifera]
KAG9391662.1	KAG9391662.1 hypothetical protein J8273_6427 [Carpediemonas membranifera]
KAG9391663.1	KAG9391663.1 hypothetical protein J8273_6428 [Carpediemonas membranifera]
KAG9391664.1	KAG9391664.1 hypothetical protein J8273_6429 [Carpediemonas membranifera]
KAG9391665.1	KAG9391665.1 Las1-like [Carpediemonas membranifera]
KAG9391666.1	KAG9391666.1 Ribonuclease H2, subunit B [Carpediemonas membranifera]
KAG9391667.1	KAG9391667.1 Translation initiation factor IF6 [Carpediemonas membranifera]
KAG9391668.1	KAG9391668.1 hypothetical protein J8273_6433 [Carpediemonas membranifera]
KAG9391669.1	KAG9391669.1 Glycosyl transferase, family 4 [Carpediemonas membranifera]
KAG9391670.1	KAG9391670.1 hypothetical protein J8273_6441 [Carpediemonas membranifera]
KAG9391671.1	KAG9391671.1 CCR4-Not complex component, Not1 [Carpediemonas membranifera]
KAG9391672.1	KAG9391672.1 hypothetical protein J8273_6443 [Carpediemonas membranifera]
KAG9391673.1	KAG9391673.1 Ribosomal protein L7Ae/L8/Nhp2 family [Carpediemonas membranifera]
KAG9391674.1	KAG9391674.1 Smg-4/UPF3 family [Carpediemonas membranifera]
KAG9391675.1	KAG9391675.1 hypothetical protein J8273_6446 [Carpediemonas membranifera]
KAG9391676.1	KAG9391676.1 Glutamate dehydrogenase [Carpediemonas membranifera]
KAG9391677.1	KAG9391677.1 hypothetical protein J8273_6448 [Carpediemonas membranifera]
KAG9391678.1	KAG9391678.1 Glutamate dehydrogenase [Carpediemonas membranifera]
KAG9391679.1	KAG9391679.1 hypothetical protein J8273_6450 [Carpediemonas membranifera]
KAG9391680.1	KAG9391680.1 NADP-specific glutamate dehydrogenase [Carpediemonas membranifera]
KAG9391681.1	KAG9391681.1 Chromo (CHRromatin Organization MOdifier) domain [Carpediemonas membranifera]
KAG9391682.1	KAG9391682.1 hypothetical protein J8273_6453 [Carpediemonas membranifera]
KAG9391683.1	KAG9391683.1 Chromo (CHRromatin Organization MOdifier) domain [Carpediemonas membranifera]
KAG9391684.1	KAG9391684.1 hypothetical protein J8273_6460 [Carpediemonas membranifera]
KAG9391685.1	KAG9391685.1 Glutamate dehydrogenase [Carpediemonas membranifera]
KAG9391686.1	KAG9391686.1 DNA repair protein REV1 [Carpediemonas membranifera]
KAG9391687.1	KAG9391687.1 Protein kinase domain [Carpediemonas membranifera]
KAG9391688.1	KAG9391688.1 hypothetical protein J8273_6464 [Carpediemonas membranifera]
KAG9391689.1	KAG9391689.1 Peptidase C26 [Carpediemonas membranifera]
KAG9391690.1	KAG9391690.1 Growth arrest-specific protein 8 [Carpediemonas membranifera]
KAG9391691.1	KAG9391691.1 hypothetical protein J8273_6467 [Carpediemonas membranifera]
KAG9391692.1	KAG9391692.1 Zinc finger C-x8-C-x5-C-x3-H type (and similar) [Carpediemonas membranifera]
KAG9391693.1	KAG9391693.1 Copine [Carpediemonas membranifera]
KAG9391694.1	KAG9391694.1 Transcription factor E2F-like [Carpediemonas membranifera]
KAG9391695.1	KAG9391695.1 protein translation factor SUI1 [Carpediemonas membranifera]
KAG9391696.1	KAG9391696.1 Ribosomal protein L31e [Carpediemonas membranifera]
KAG9391697.1	KAG9391697.1 Tubulin-tyrosine ligase/Tubulin polyglutamylase [Carpediemonas membranifera]
KAG9391698.1	KAG9391698.1 Prokaryotic membrane lipoprotein lipid attachment site [Carpediemonas membranifera]
KAG9391699.1	KAG9391699.1 Coatomer subunit, alpha (CopA) [Carpediemonas membranifera]
KAG9391700.1	KAG9391700.1 hypothetical protein J8273_6476 [Carpediemonas membranifera]
KAG9391701.1	KAG9391701.1 hypothetical protein J8273_6477 [Carpediemonas membranifera]
KAG9391702.1	KAG9391702.1 Nek1 Ser/Thr kinase-like [Carpediemonas membranifera]
KAG9391703.1	KAG9391703.1 hypothetical protein J8273_6479 [Carpediemonas membranifera]
KAG9391704.1	KAG9391704.1 hypothetical protein J8273_6480 [Carpediemonas membranifera]
KAG9391705.1	KAG9391705.1 DEAD/DEAH box helicase [Carpediemonas membranifera]
KAG9391706.1	KAG9391706.1 hypothetical protein J8273_6482 [Carpediemonas membranifera]
KAG9391707.1	KAG9391707.1 hypothetical protein J8273_6483 [Carpediemonas membranifera]
KAG9391708.1	KAG9391708.1 Chromosome partition protein Smc [Carpediemonas membranifera]
KAG9391709.1	KAG9391709.1 Protein phosphatase [Carpediemonas membranifera]
KAG9391710.1	KAG9391710.1 Exosome complex component CSL4 [Carpediemonas membranifera]
KAG9391711.1	KAG9391711.1 Chromosome partition protein Smc [Carpediemonas membranifera]
KAG9391712.1	KAG9391712.1 solute carrier family 35 member F3-like [Carpediemonas membranifera]
KAG9391713.1	KAG9391713.1 hypothetical protein J8273_6489 [Carpediemonas membranifera]
KAG9391714.1	KAG9391714.1 Kinesin motor domain [Carpediemonas membranifera]
KAG9391715.1	KAG9391715.1 hypothetical protein J8273_6491 [Carpediemonas membranifera]
KAG9391716.1	KAG9391716.1 IBR domain [Carpediemonas membranifera]
KAG9391717.1	KAG9391717.1 Glycoside hydrolase, family 31 [Carpediemonas membranifera]
KAG9391718.1	KAG9391718.1 hypothetical protein J8273_6494 [Carpediemonas membranifera]
KAG9391719.1	KAG9391719.1 Histone H4 [Carpediemonas membranifera]
KAG9391720.1	KAG9391720.1 BRCA1 C Terminus (BRCT) domain [Carpediemonas membranifera]
KAG9391721.1	KAG9391721.1 Leucine Rich repeats (2 copies) [Carpediemonas membranifera]
KAG9391722.1	KAG9391722.1 hypothetical protein J8273_6498 [Carpediemonas membranifera]
KAG9391723.1	KAG9391723.1 Kae1/YgjD family [Carpediemonas membranifera]
KAG9391724.1	KAG9391724.1 Intraflagellar transport complex B protein 46 [Carpediemonas membranifera]
KAG9391725.1	KAG9391725.1 hypothetical protein J8273_6501 [Carpediemonas membranifera]
KAG9391726.1	KAG9391726.1 hypothetical protein J8273_6502 [Carpediemonas membranifera]
KAG9391727.1	KAG9391727.1 hypothetical protein J8273_6503 [Carpediemonas membranifera]
KAG9391728.1	KAG9391728.1 hypothetical protein J8273_6504 [Carpediemonas membranifera]
KAG9391729.1	KAG9391729.1 Galactose oxidase, central domain [Carpediemonas membranifera]
KAG9391730.1	KAG9391730.1 hypothetical protein J8273_6506 [Carpediemonas membranifera]
KAG9391731.1	KAG9391731.1 chromosome segregation protein [Carpediemonas membranifera]
KAG9391732.1	KAG9391732.1 Ornithine/DAP/Arg decarboxylase [Carpediemonas membranifera]
KAG9391733.1	KAG9391733.1 hypothetical protein J8273_6509 [Carpediemonas membranifera]
KAG9391734.1	KAG9391734.1 RNA 2'-phosphotransferase [Carpediemonas membranifera]
KAG9391735.1	KAG9391735.1 Glutathione synthase, eukaryotic [Carpediemonas membranifera]
KAG9391736.1	KAG9391736.1 TM2 domain protein [Carpediemonas membranifera]
KAG9391737.1	KAG9391737.1 hypothetical protein J8273_6513 [Carpediemonas membranifera]
KAG9391738.1	KAG9391738.1 Tubulin [Carpediemonas membranifera]
KAG9391739.1	KAG9391739.1 V-type ATPase, V0 complex, 116kDa subunit family [Carpediemonas membranifera]
KAG9391740.1	KAG9391740.1 RNA recognition motif [Carpediemonas membranifera]
KAG9391741.1	KAG9391741.1 hypothetical protein J8273_6517 [Carpediemonas membranifera]
KAG9391742.1	KAG9391742.1 hypothetical protein J8273_6518 [Carpediemonas membranifera]
KAG9391743.1	KAG9391743.1 Type I phosphodiesterase/nucleotide pyrophosphatase/phosphate transferase [Carpediemonas membranifera]
KAG9391744.1	KAG9391744.1 Peptide chain release factor eRF1/aRF1 [Carpediemonas membranifera]
KAG9391745.1	KAG9391745.1 Mob1/phocein [Carpediemonas membranifera]
KAG9391746.1	KAG9391746.1 SWIRM domain [Carpediemonas membranifera]
KAG9391747.1	KAG9391747.1 Prokaryotic membrane lipoprotein lipid attachment site [Carpediemonas membranifera]
KAG9391748.1	KAG9391748.1 Exonuclease [Carpediemonas membranifera]
KAG9391749.1	KAG9391749.1 ras-related protein Rab-24 [Carpediemonas membranifera]
KAG9391750.1	KAG9391750.1 Dynein heavy chain and region D6 of dynein motor [Carpediemonas membranifera]
KAG9391751.1	KAG9391751.1 Regulator of chromosome condensation (RCC1) repeat [Carpediemonas membranifera]
KAG9391752.1	KAG9391752.1 Heat shock protein Hsp90 family [Carpediemonas membranifera]
KAG9391753.1	KAG9391753.1 Chromosome partition protein Smc [Carpediemonas membranifera]
KAG9391754.1	KAG9391754.1 Ribosomal protein L18e/L15 [Carpediemonas membranifera]
KAG9391755.1	KAG9391755.1 Ribosomal protein S4/S9, eukaryotic/archaeal [Carpediemonas membranifera]
KAG9391756.1	KAG9391756.1 hypothetical protein J8273_6532 [Carpediemonas membranifera]
KAG9391757.1	KAG9391757.1 Elongation factor Tu GTP binding domain [Carpediemonas membranifera]
KAG9391758.1	KAG9391758.1 WD domain, G-beta repeat [Carpediemonas membranifera]
KAG9391759.1	KAG9391759.1 Mitochondrial carrier protein [Carpediemonas membranifera]
KAG9391760.1	KAG9391760.1 Thiamine pyrophosphate enzyme, C-terminal TPP binding domain [Carpediemonas membranifera]
KAG9391761.1	KAG9391761.1 Pyruvate-flavodoxin oxidoreductase [Carpediemonas membranifera]
KAG9391762.1	KAG9391762.1 Pyruvate-flavodoxin oxidoreductase [Carpediemonas membranifera]
KAG9391763.1	KAG9391763.1 Sodium/sulfate symporter [Carpediemonas membranifera]
KAG9391764.1	KAG9391764.1 Fructose-1,6-bisphosphatase class 3 [Carpediemonas membranifera]
KAG9391765.1	KAG9391765.1 Protein of unknown function DUF4591 [Carpediemonas membranifera]
KAG9391766.1	KAG9391766.1 Ribosomal protein L10/acidic P0 [Carpediemonas membranifera]
KAG9391767.1	KAG9391767.1 hypothetical protein J8273_6546 [Carpediemonas membranifera]
KAG9391768.1	KAG9391768.1 RuvB-like, INO80J [Carpediemonas membranifera]
KAG9391769.1	KAG9391769.1 hypothetical protein J8273_6548 [Carpediemonas membranifera]
KAG9391770.1	KAG9391770.1 MgsA AAA+ ATPase C terminal [Carpediemonas membranifera]
KAG9391771.1	KAG9391771.1 Tiny Tim (Tim8/Tim9/Tim10/Tim13) [Carpediemonas membranifera]
KAG9391772.1	KAG9391772.1 UV-stimulated scaffold protein A, UVSSA [Carpediemonas membranifera]
KAG9391773.1	KAG9391773.1 NUDIX domain [Carpediemonas membranifera]
KAG9391774.1	KAG9391774.1 Kinesin motor domain [Carpediemonas membranifera]
KAG9391775.1	KAG9391775.1 hypothetical protein J8273_6554 [Carpediemonas membranifera]
KAG9391776.1	KAG9391776.1 hypothetical protein J8273_6555 [Carpediemonas membranifera]
KAG9391777.1	KAG9391777.1 ThiF family [Carpediemonas membranifera]
KAG9391778.1	KAG9391778.1 DNA polymerase kappa, POLK [Carpediemonas membranifera]
KAG9391779.1	KAG9391779.1 hypothetical protein J8273_6558 [Carpediemonas membranifera]
KAG9391780.1	KAG9391780.1 PKD domain-containing protein [Carpediemonas membranifera]
KAG9391781.1	KAG9391781.1 regulator of chromosome condensation (RCC1) repeat family protein [Carpediemonas membranifera]
KAG9391782.1	KAG9391782.1 hypothetical protein J8273_6561 [Carpediemonas membranifera]
KAG9391783.1	KAG9391783.1 hypothetical protein J8273_6562 [Carpediemonas membranifera]
KAG9391784.1	KAG9391784.1 hypothetical protein J8273_6563 [Carpediemonas membranifera]
KAG9391785.1	KAG9391785.1 Homeobox domain [Carpediemonas membranifera]
KAG9391786.1	KAG9391786.1 Ribosomal protein S3Ae [Carpediemonas membranifera]
KAG9391787.1	KAG9391787.1 Ribosomal protein S3Ae [Carpediemonas membranifera]
KAG9391788.1	KAG9391788.1 Dynein light chain, type 1/2 [Carpediemonas membranifera]
KAG9391789.1	KAG9391789.1 hypothetical protein J8273_6568 [Carpediemonas membranifera]
KAG9391790.1	KAG9391790.1 hypothetical protein J8273_6569 [Carpediemonas membranifera]
KAG9391791.1	KAG9391791.1 hypothetical protein J8273_6570 [Carpediemonas membranifera]
KAG9391792.1	KAG9391792.1 Secretion Associated Ras Related GTPase 1, A (SAR1A) [Carpediemonas membranifera]
KAG9391793.1	KAG9391793.1 Protein of unknown function (DUF2435) [Carpediemonas membranifera]
KAG9391794.1	KAG9391794.1 Glucose/ribitol dehydrogenase [Carpediemonas membranifera]
KAG9391795.1	KAG9391795.1 hypothetical protein J8273_6574 [Carpediemonas membranifera]
KAG9391796.1	KAG9391796.1 Kinesin motor domain [Carpediemonas membranifera]
KAG9391797.1	KAG9391797.1 hypothetical protein J8273_6576 [Carpediemonas membranifera]
KAG9391798.1	KAG9391798.1 hypothetical protein J8273_6577 [Carpediemonas membranifera]
KAG9391799.1	KAG9391799.1 Small GTPase superfamily [Carpediemonas membranifera]
KAG9391800.1	KAG9391800.1 hypothetical protein J8273_6579 [Carpediemonas membranifera]
KAG9391801.1	KAG9391801.1 High-temperature-induced dauer-formation protein [Carpediemonas membranifera]
KAG9391802.1	KAG9391802.1 hypothetical protein J8273_6581 [Carpediemonas membranifera]
KAG9391803.1	KAG9391803.1 hypothetical protein J8273_6582 [Carpediemonas membranifera]
KAG9391804.1	KAG9391804.1 hypothetical protein J8273_6583 [Carpediemonas membranifera]
KAG9391805.1	KAG9391805.1 hypothetical protein J8273_6584 [Carpediemonas membranifera]
KAG9391806.1	KAG9391806.1 Cyclin, N-terminal domain [Carpediemonas membranifera]
KAG9391807.1	KAG9391807.1 hypothetical protein J8273_6586 [Carpediemonas membranifera]
KAG9391808.1	KAG9391808.1 hypothetical protein J8273_6591 [Carpediemonas membranifera]
KAG9391809.1	KAG9391809.1 hypothetical protein J8273_6904 [Carpediemonas membranifera]
KAG9391810.1	KAG9391810.1 hypothetical protein J8273_6908 [Carpediemonas membranifera]
KAG9391811.1	KAG9391811.1 hypothetical protein J8273_6910 [Carpediemonas membranifera]
KAG9391812.1	KAG9391812.1 DDE superfamily endonuclease [Carpediemonas membranifera]
KAG9391813.1	KAG9391813.1 SET domain [Carpediemonas membranifera]
KAG9391814.1	KAG9391814.1 serine/threonine protein kinase [Carpediemonas membranifera]
KAG9391815.1	KAG9391815.1 hypothetical protein J8273_6916 [Carpediemonas membranifera]
KAG9391816.1	KAG9391816.1 hypothetical protein J8273_6917, partial [Carpediemonas membranifera]
KAG9391817.1	KAG9391817.1 Geminivirus Rep catalytic domain [Carpediemonas membranifera]
KAG9391818.1	KAG9391818.1 Chromo (CHRromatin Organization MOdifier) domain [Carpediemonas membranifera]
KAG9391819.1	KAG9391819.1 Aspartyl protease [Carpediemonas membranifera]
KAG9391820.1	KAG9391820.1 hypothetical protein J8273_6888 [Carpediemonas membranifera]
KAG9391821.1	KAG9391821.1 hypothetical protein J8273_6889 [Carpediemonas membranifera]
KAG9391822.1	KAG9391822.1 hypothetical protein J8273_6890 [Carpediemonas membranifera]
KAG9391823.1	KAG9391823.1 hypothetical protein J8273_6891 [Carpediemonas membranifera]
KAG9391824.1	KAG9391824.1 hypothetical protein J8273_6892 [Carpediemonas membranifera]
KAG9391825.1	KAG9391825.1 hypothetical protein J8273_6893 [Carpediemonas membranifera]
KAG9391826.1	KAG9391826.1 hypothetical protein J8273_6894 [Carpediemonas membranifera]
KAG9391827.1	KAG9391827.1 Small GTPase superfamily [Carpediemonas membranifera]
KAG9391828.1	KAG9391828.1 hypothetical protein J8273_6896 [Carpediemonas membranifera]
KAG9391829.1	KAG9391829.1 Tubulin [Carpediemonas membranifera]
KAG9391830.1	KAG9391830.1 hypothetical protein J8273_6898 [Carpediemonas membranifera]
KAG9391831.1	KAG9391831.1 Pirin [Carpediemonas membranifera]
KAG9391832.1	KAG9391832.1 hypothetical protein J8273_6900 [Carpediemonas membranifera]
KAG9391833.1	KAG9391833.1 Myb-like DNA-binding domain [Carpediemonas membranifera]
KAG9391834.1	KAG9391834.1 hypothetical protein J8273_6847 [Carpediemonas membranifera]
KAG9391835.1	KAG9391835.1 ABC transporter A family member 2 [Carpediemonas membranifera]
KAG9391836.1	KAG9391836.1 hypothetical protein J8273_6849 [Carpediemonas membranifera]
KAG9391837.1	KAG9391837.1 hypothetical protein J8273_6850 [Carpediemonas membranifera]
KAG9391838.1	KAG9391838.1 Sec1-like protein [Carpediemonas membranifera]
KAG9391839.1	KAG9391839.1 Chaperonin Cpn60/TCP-1 [Carpediemonas membranifera]
KAG9391840.1	KAG9391840.1 hypothetical protein J8273_6853 [Carpediemonas membranifera]
KAG9391841.1	KAG9391841.1 Exonuclease [Carpediemonas membranifera]
KAG9391842.1	KAG9391842.1 hypothetical protein J8273_6855 [Carpediemonas membranifera]
KAG9391843.1	KAG9391843.1 hypothetical protein J8273_6856 [Carpediemonas membranifera]
KAG9391844.1	KAG9391844.1 hypothetical protein J8273_6857 [Carpediemonas membranifera]
KAG9391845.1	KAG9391845.1 ABC transporter [Carpediemonas membranifera]
KAG9391846.1	KAG9391846.1 hypothetical protein J8273_6859 [Carpediemonas membranifera]
KAG9391847.1	KAG9391847.1 hypothetical protein J8273_6860 [Carpediemonas membranifera]
KAG9391848.1	KAG9391848.1 hypothetical protein J8273_6861 [Carpediemonas membranifera]
KAG9391849.1	KAG9391849.1 Prokaryotic membrane lipoprotein lipid attachment site [Carpediemonas membranifera]
KAG9391850.1	KAG9391850.1 Protein kinase domain [Carpediemonas membranifera]
