id	desc
KAG9393672.1	KAG9393672.1 putative protein serine/threonine kinase [Carpediemonas membranifera]
KAG9393673.1	KAG9393673.1 Chromosome partition protein Smc [Carpediemonas membranifera]
KAG9393674.1	KAG9393674.1 hypothetical protein J8273_4793 [Carpediemonas membranifera]
KAG9393675.1	KAG9393675.1 WRKY DNA -binding domain [Carpediemonas membranifera]
KAG9393676.1	KAG9393676.1 C20orf85 family protein [Carpediemonas membranifera]
KAG9393677.1	KAG9393677.1 hypothetical protein J8273_4796 [Carpediemonas membranifera]
KAG9393678.1	KAG9393678.1 Replication factor A protein 3, RFA3 [Carpediemonas membranifera]
KAG9393679.1	KAG9393679.1 SNF2 family N-terminal domain [Carpediemonas membranifera]
KAG9393680.1	KAG9393680.1 WD domain, G-beta repeat [Carpediemonas membranifera]
KAG9393681.1	KAG9393681.1 dimethyladenosine transferase [Carpediemonas membranifera]
KAG9393682.1	KAG9393682.1 Glycine-C-acetyltransferase [Carpediemonas membranifera]
KAG9393683.1	KAG9393683.1 Integral membrane protein SYS1-related [Carpediemonas membranifera]
KAG9393684.1	KAG9393684.1 EF-hand calcium-binding domain [Carpediemonas membranifera]
KAG9393685.1	KAG9393685.1 chromosome segregation protein [Carpediemonas membranifera]
KAG9393686.1	KAG9393686.1 Sec1-like protein [Carpediemonas membranifera]
KAG9393687.1	KAG9393687.1 hypothetical protein J8273_4806 [Carpediemonas membranifera]
KAG9393688.1	KAG9393688.1 Pre-rRNA-processing protein TSR2 [Carpediemonas membranifera]
KAG9393689.1	KAG9393689.1 hypothetical protein J8273_4808 [Carpediemonas membranifera]
KAG9393690.1	KAG9393690.1 hypothetical protein J8273_4809 [Carpediemonas membranifera]
KAG9393691.1	KAG9393691.1 SWIRM domain [Carpediemonas membranifera]
KAG9393692.1	KAG9393692.1 Inositol-tetrakisphosphate 1-kinase 4 -like protein [Carpediemonas membranifera]
KAG9393693.1	KAG9393693.1 Gamma-tubulin complex component protein [Carpediemonas membranifera]
KAG9393694.1	KAG9393694.1 hypothetical protein J8273_4813 [Carpediemonas membranifera]
KAG9393695.1	KAG9393695.1 hypothetical protein J8273_4814 [Carpediemonas membranifera]
KAG9393696.1	KAG9393696.1 Fis1 [Carpediemonas membranifera]
KAG9393697.1	KAG9393697.1 Alpha/beta hydrolase family [Carpediemonas membranifera]
KAG9393698.1	KAG9393698.1 Kinesin motor domain [Carpediemonas membranifera]
KAG9393699.1	KAG9393699.1 hypothetical protein J8273_4818 [Carpediemonas membranifera]
KAG9393700.1	KAG9393700.1 Anticodon-binding domain [Carpediemonas membranifera]
KAG9393701.1	KAG9393701.1 Small GTPase superfamily, ARF type [Carpediemonas membranifera]
KAG9393702.1	KAG9393702.1 Calcineurin-like phosphoesterase superfamily domain [Carpediemonas membranifera]
KAG9393703.1	KAG9393703.1 Peptidase C13, legumain [Carpediemonas membranifera]
KAG9393704.1	KAG9393704.1 Ribonucleases P/MRP protein subunit POP1 [Carpediemonas membranifera]
KAG9393705.1	KAG9393705.1 Cyclophilin-type peptidyl-prolyl cis-trans isomerase [Carpediemonas membranifera]
KAG9393706.1	KAG9393706.1 protein CSN12 [Carpediemonas membranifera]
KAG9393707.1	KAG9393707.1 hypothetical protein J8273_4826 [Carpediemonas membranifera]
KAG9393708.1	KAG9393708.1 hypothetical protein J8273_4827 [Carpediemonas membranifera]
KAG9393709.1	KAG9393709.1 hypothetical protein J8273_4828 [Carpediemonas membranifera]
KAG9393710.1	KAG9393710.1 Homeobox domain [Carpediemonas membranifera]
KAG9393711.1	KAG9393711.1 hypothetical protein J8273_4830 [Carpediemonas membranifera]
KAG9393712.1	KAG9393712.1 hypothetical protein J8273_4831 [Carpediemonas membranifera]
KAG9393713.1	KAG9393713.1 fused Aspartate/ornithine carbamoyltransferase and carbamate kinase [Carpediemonas membranifera]
KAG9393714.1	KAG9393714.1 hypothetical protein J8273_4833 [Carpediemonas membranifera]
KAG9393715.1	KAG9393715.1 hypothetical protein J8273_4834 [Carpediemonas membranifera]
KAG9393716.1	KAG9393716.1 Tubulin [Carpediemonas membranifera]
KAG9393717.1	KAG9393717.1 WD domain, G-beta repeat [Carpediemonas membranifera]
KAG9393718.1	KAG9393718.1 hypothetical protein J8273_4837 [Carpediemonas membranifera]
KAG9393719.1	KAG9393719.1 DEAD/DEAH box helicase [Carpediemonas membranifera]
KAG9393720.1	KAG9393720.1 26S proteasome non-ATPase regulatory subunit 12 [Carpediemonas membranifera]
KAG9393721.1	KAG9393721.1 Ubiquitin carboxyl-terminal hydrolase [Carpediemonas membranifera]
KAG9393722.1	KAG9393722.1 BING4CT (NUC141) domain [Carpediemonas membranifera]
KAG9393723.1	KAG9393723.1 Eukaryotic RNA Recognition Motif [Carpediemonas membranifera]
KAG9393724.1	KAG9393724.1 Chromosome partition protein Smc [Carpediemonas membranifera]
KAG9393725.1	KAG9393725.1 hypothetical protein J8273_4844 [Carpediemonas membranifera]
KAG9393726.1	KAG9393726.1 TPR repeat [Carpediemonas membranifera]
KAG9393727.1	KAG9393727.1 hypothetical protein J8273_4846 [Carpediemonas membranifera]
KAG9393728.1	KAG9393728.1 ADP-ribosylation factor-like protein [Carpediemonas membranifera]
KAG9393729.1	KAG9393729.1 hypothetical protein J8273_4848 [Carpediemonas membranifera]
KAG9393730.1	KAG9393730.1 Acetyl-CoA synthetase [Carpediemonas membranifera]
KAG9393731.1	KAG9393731.1 Acetyl-CoA synthetase [Carpediemonas membranifera]
KAG9393732.1	KAG9393732.1 hypothetical protein J8273_4851 [Carpediemonas membranifera]
KAG9393733.1	KAG9393733.1 putative polysaccharide biosynthesis protein [Carpediemonas membranifera]
KAG9393734.1	KAG9393734.1 hypothetical protein J8273_4853 [Carpediemonas membranifera]
KAG9393735.1	KAG9393735.1 Chromosome partition protein Smc [Carpediemonas membranifera]
KAG9393736.1	KAG9393736.1 Myo-inositol-1-phosphate synthase [Carpediemonas membranifera]
KAG9393737.1	KAG9393737.1 Tom7 [Carpediemonas membranifera]
KAG9393738.1	KAG9393738.1 vesicle-associated membrane protein 7B [Carpediemonas membranifera]
KAG9393739.1	KAG9393739.1 SERF family protein [Carpediemonas membranifera]
KAG9393740.1	KAG9393740.1 SERF family protein [Carpediemonas membranifera]
KAG9393741.1	KAG9393741.1 Vacuolar protein sorting-associated protein 11-like protein [Carpediemonas membranifera]
KAG9393742.1	KAG9393742.1 Glycosyl transferases group 1 [Carpediemonas membranifera]
KAG9393743.1	KAG9393743.1 Prefoldin subunit [Carpediemonas membranifera]
KAG9393744.1	KAG9393744.1 AMP-binding enzyme [Carpediemonas membranifera]
KAG9393745.1	KAG9393745.1 RNA polymerase, subunit omega/K/RPB6 [Carpediemonas membranifera]
KAG9393746.1	KAG9393746.1 phospholipase B-like protein [Carpediemonas membranifera]
KAG9393747.1	KAG9393747.1 hypothetical protein J8273_4866 [Carpediemonas membranifera]
KAG9393748.1	KAG9393748.1 Structure-specific endonuclease subunit SLX1 [Carpediemonas membranifera]
KAG9393749.1	KAG9393749.1 hypothetical protein J8273_4868 [Carpediemonas membranifera]
KAG9393750.1	KAG9393750.1 Proteasome, subunit alpha/beta [Carpediemonas membranifera]
KAG9393751.1	KAG9393751.1 hypothetical protein J8273_4870 [Carpediemonas membranifera]
KAG9393752.1	KAG9393752.1 Phosphatidylinositol-4-phosphate 5-Kinase [Carpediemonas membranifera]
KAG9393753.1	KAG9393753.1 hypothetical protein J8273_4872 [Carpediemonas membranifera]
KAG9393754.1	KAG9393754.1 CDC50/LEM3 family [Carpediemonas membranifera]
KAG9393755.1	KAG9393755.1 hypothetical protein J8273_4874 [Carpediemonas membranifera]
KAG9393756.1	KAG9393756.1 DEAD/DEAH box helicase [Carpediemonas membranifera]
KAG9393757.1	KAG9393757.1 hypothetical protein J8273_4876 [Carpediemonas membranifera]
KAG9393758.1	KAG9393758.1 hypothetical protein J8273_4877 [Carpediemonas membranifera]
KAG9393759.1	KAG9393759.1 hypothetical protein J8273_4878 [Carpediemonas membranifera]
KAG9393760.1	KAG9393760.1 hypothetical protein J8273_4879 [Carpediemonas membranifera]
KAG9393761.1	KAG9393761.1 hypothetical protein J8273_4624 [Carpediemonas membranifera]
KAG9393762.1	KAG9393762.1 DEAD/DEAH box helicase [Carpediemonas membranifera]
KAG9393763.1	KAG9393763.1 TPR repeat [Carpediemonas membranifera]
KAG9393764.1	KAG9393764.1 MIF4G domain [Carpediemonas membranifera]
KAG9393765.1	KAG9393765.1 hypothetical protein J8273_4628 [Carpediemonas membranifera]
KAG9393766.1	KAG9393766.1 Calcineurin-like phosphoesterase [Carpediemonas membranifera]
KAG9393767.1	KAG9393767.1 hypothetical protein J8273_4630 [Carpediemonas membranifera]
KAG9393768.1	KAG9393768.1 hypothetical protein J8273_4631 [Carpediemonas membranifera]
KAG9393769.1	KAG9393769.1 hypothetical protein J8273_4632 [Carpediemonas membranifera]
KAG9393770.1	KAG9393770.1 Leucine rich repeat [Carpediemonas membranifera]
KAG9393771.1	KAG9393771.1 Protein kinase domain [Carpediemonas membranifera]
KAG9393772.1	KAG9393772.1 hypothetical protein J8273_4635 [Carpediemonas membranifera]
KAG9393773.1	KAG9393773.1 protein of unknown function (DUF4496) [Carpediemonas membranifera]
KAG9393774.1	KAG9393774.1 TLC domain [Carpediemonas membranifera]
KAG9393775.1	KAG9393775.1 EF-hand domain [Carpediemonas membranifera]
KAG9393776.1	KAG9393776.1 Equilibrative nucleoside transporter [Carpediemonas membranifera]
KAG9393777.1	KAG9393777.1 hypothetical protein J8273_4640 [Carpediemonas membranifera]
KAG9393778.1	KAG9393778.1 Leucine Rich repeat [Carpediemonas membranifera]
KAG9393779.1	KAG9393779.1 hypothetical protein J8273_4642 [Carpediemonas membranifera]
KAG9393780.1	KAG9393780.1 hypothetical protein J8273_4643 [Carpediemonas membranifera]
KAG9393781.1	KAG9393781.1 Ribosomal protein L30e [Carpediemonas membranifera]
KAG9393782.1	KAG9393782.1 Ribosomal protein L44e [Carpediemonas membranifera]
KAG9393783.1	KAG9393783.1 Regulator of chromosome condensation (RCC1) repeat [Carpediemonas membranifera]
KAG9393784.1	KAG9393784.1 Trp-Asp (WD) repeat protein [Carpediemonas membranifera]
KAG9393785.1	KAG9393785.1 Zinc/iron permease [Carpediemonas membranifera]
KAG9393786.1	KAG9393786.1 zinc finger protein [Carpediemonas membranifera]
KAG9393787.1	KAG9393787.1 hypothetical protein J8273_4650 [Carpediemonas membranifera]
KAG9393788.1	KAG9393788.1 Synaptobrevin [Carpediemonas membranifera]
KAG9393789.1	KAG9393789.1 hypothetical protein J8273_4652 [Carpediemonas membranifera]
KAG9393790.1	KAG9393790.1 Hydroxymethyl-glutaryl-CoA lyase [Carpediemonas membranifera]
KAG9393791.1	KAG9393791.1 Synaptobrevin [Carpediemonas membranifera]
KAG9393792.1	KAG9393792.1 hypothetical protein J8273_4655 [Carpediemonas membranifera]
KAG9393793.1	KAG9393793.1 hypothetical protein J8273_4656 [Carpediemonas membranifera]
KAG9393794.1	KAG9393794.1 Adaptor Protein Complex 2 subunit sigma (AP2S1) [Carpediemonas membranifera]
KAG9393795.1	KAG9393795.1 hypothetical protein J8273_4658 [Carpediemonas membranifera]
KAG9393796.1	KAG9393796.1 Thioredoxin reductase [Carpediemonas membranifera]
KAG9393797.1	KAG9393797.1 hypothetical protein J8273_4660 [Carpediemonas membranifera]
KAG9393798.1	KAG9393798.1 Proteasome subunit alpha/beta [Carpediemonas membranifera]
KAG9393799.1	KAG9393799.1 Tim44 [Carpediemonas membranifera]
KAG9393800.1	KAG9393800.1 Small GTPase superfamily [Carpediemonas membranifera]
KAG9393801.1	KAG9393801.1 hypothetical protein J8273_4664 [Carpediemonas membranifera]
KAG9393802.1	KAG9393802.1 hypothetical protein J8273_4665 [Carpediemonas membranifera]
KAG9393803.1	KAG9393803.1 Small GTPase superfamily [Carpediemonas membranifera]
KAG9393804.1	KAG9393804.1 hypothetical protein J8273_4667 [Carpediemonas membranifera]
KAG9393805.1	KAG9393805.1 hypothetical protein J8273_4668 [Carpediemonas membranifera]
KAG9393806.1	KAG9393806.1 RNA polymerase II subunit A [Carpediemonas membranifera]
KAG9393807.1	KAG9393807.1 hypothetical protein J8273_4670 [Carpediemonas membranifera]
KAG9393808.1	KAG9393808.1 hypothetical protein J8273_4671 [Carpediemonas membranifera]
KAG9393809.1	KAG9393809.1 hypothetical protein J8273_4672 [Carpediemonas membranifera]
KAG9393810.1	KAG9393810.1 hypothetical protein J8273_4673 [Carpediemonas membranifera]
KAG9393811.1	KAG9393811.1 U2 auxiliary factor small subunit [Carpediemonas membranifera]
KAG9393812.1	KAG9393812.1 hypothetical protein J8273_4675 [Carpediemonas membranifera]
KAG9393813.1	KAG9393813.1 hypothetical protein J8273_4676 [Carpediemonas membranifera]
KAG9393814.1	KAG9393814.1 Phosphotyrosyl phosphatase activator PTPA [Carpediemonas membranifera]
KAG9393815.1	KAG9393815.1 Ribosomal protein L5 [Carpediemonas membranifera]
KAG9393816.1	KAG9393816.1 hypothetical protein J8273_4679 [Carpediemonas membranifera]
KAG9393817.1	KAG9393817.1 Ribosomal protein S15 [Carpediemonas membranifera]
KAG9393818.1	KAG9393818.1 hypothetical protein J8273_4681 [Carpediemonas membranifera]
KAG9393819.1	KAG9393819.1 UDP-N-acetylglucosamine pyrophosphorylase [Carpediemonas membranifera]
KAG9393820.1	KAG9393820.1 Ubiquitin-conjugating enzyme [Carpediemonas membranifera]
KAG9393821.1	KAG9393821.1 Ribonuclease HII [Carpediemonas membranifera]
KAG9393822.1	KAG9393822.1 Acetyltransferase (GNAT) domain [Carpediemonas membranifera]
KAG9393823.1	KAG9393823.1 hypothetical protein J8273_4686 [Carpediemonas membranifera]
KAG9393824.1	KAG9393824.1 Thymidine kinase [Carpediemonas membranifera]
KAG9393825.1	KAG9393825.1 hypothetical protein J8273_4688 [Carpediemonas membranifera]
KAG9393826.1	KAG9393826.1 hypothetical protein J8273_4689 [Carpediemonas membranifera]
KAG9393827.1	KAG9393827.1 ferritin [Carpediemonas membranifera]
KAG9393828.1	KAG9393828.1 hypothetical protein J8273_4691 [Carpediemonas membranifera]
KAG9393829.1	KAG9393829.1 hypothetical protein J8273_4692 [Carpediemonas membranifera]
KAG9393830.1	KAG9393830.1 hypothetical protein J8273_4693 [Carpediemonas membranifera]
KAG9393831.1	KAG9393831.1 cyclin-dependent kinase-like [Carpediemonas membranifera]
KAG9393832.1	KAG9393832.1 hypothetical protein J8273_4695 [Carpediemonas membranifera]
KAG9393833.1	KAG9393833.1 Small GTPase superfamily [Carpediemonas membranifera]
KAG9393834.1	KAG9393834.1 hypothetical protein J8273_4697 [Carpediemonas membranifera]
KAG9393835.1	KAG9393835.1 Translation elongation factor IF5A [Carpediemonas membranifera]
KAG9393836.1	KAG9393836.1 Calmodulin-like protein [Carpediemonas membranifera]
KAG9393837.1	KAG9393837.1 Protein kinase domain [Carpediemonas membranifera]
KAG9393838.1	KAG9393838.1 Protein kinase domain [Carpediemonas membranifera]
KAG9393839.1	KAG9393839.1 Protein kinase domain [Carpediemonas membranifera]
KAG9393840.1	KAG9393840.1 Protein kinase domain [Carpediemonas membranifera]
KAG9393841.1	KAG9393841.1 Chromosome partition protein Smc [Carpediemonas membranifera]
KAG9393842.1	KAG9393842.1 hypothetical protein J8273_4705 [Carpediemonas membranifera]
KAG9393843.1	KAG9393843.1 Proteasome subunit alpha/beta [Carpediemonas membranifera]
KAG9393844.1	KAG9393844.1 flagellar associated protein [Carpediemonas membranifera]
KAG9393845.1	KAG9393845.1 Chromosome partition protein Smc [Carpediemonas membranifera]
KAG9393846.1	KAG9393846.1 hypothetical protein J8273_4709 [Carpediemonas membranifera]
KAG9393847.1	KAG9393847.1 GNL3L/Grn1 putative GTPase [Carpediemonas membranifera]
KAG9393848.1	KAG9393848.1 Armadillo/beta-catenin-like repeat [Carpediemonas membranifera]
KAG9393849.1	KAG9393849.1 hypothetical protein J8273_4712 [Carpediemonas membranifera]
KAG9393850.1	KAG9393850.1 Alpha/beta hydrolase family [Carpediemonas membranifera]
KAG9393851.1	KAG9393851.1 Homeobox domain [Carpediemonas membranifera]
KAG9393852.1	KAG9393852.1 hypothetical protein J8273_4715 [Carpediemonas membranifera]
KAG9393853.1	KAG9393853.1 hypothetical protein J8273_4716 [Carpediemonas membranifera]
KAG9393854.1	KAG9393854.1 hypothetical protein J8273_4717 [Carpediemonas membranifera]
KAG9393855.1	KAG9393855.1 Ribosomal protein L24e [Carpediemonas membranifera]
KAG9393856.1	KAG9393856.1 ubiquitin-conjugating enzyme Ube2S [Carpediemonas membranifera]
KAG9393857.1	KAG9393857.1 Dynein light chain-related [Carpediemonas membranifera]
KAG9393858.1	KAG9393858.1 Vesicle coat protein involved in Golgi to plasma membrane transport [Carpediemonas membranifera]
KAG9393859.1	KAG9393859.1 hypothetical protein J8273_4722 [Carpediemonas membranifera]
KAG9393860.1	KAG9393860.1 hypothetical protein J8273_4723 [Carpediemonas membranifera]
KAG9393861.1	KAG9393861.1 Non-structural maintenance of chromosomes element 1 NSE1 [Carpediemonas membranifera]
KAG9393862.1	KAG9393862.1 Kinesin motor domain [Carpediemonas membranifera]
KAG9393863.1	KAG9393863.1 SKIP/SNW domain [Carpediemonas membranifera]
KAG9393864.1	KAG9393864.1 hypothetical protein J8273_4728 [Carpediemonas membranifera]
KAG9393865.1	KAG9393865.1 hypothetical protein J8273_4729 [Carpediemonas membranifera]
KAG9393866.1	KAG9393866.1 hypothetical protein J8273_4730 [Carpediemonas membranifera]
KAG9393867.1	KAG9393867.1 Hydantoinase/dihydropyrimidinase [Carpediemonas membranifera]
KAG9393868.1	KAG9393868.1 CBF/Mak21 family [Carpediemonas membranifera]
KAG9393869.1	KAG9393869.1 PAP2 superfamily [Carpediemonas membranifera]
KAG9393870.1	KAG9393870.1 Glycine cleavage system H-protein [Carpediemonas membranifera]
KAG9393871.1	KAG9393871.1 ribosomal protein S12 [Carpediemonas membranifera]
KAG9393872.1	KAG9393872.1 iron-sulfur cluster assembly protein [Carpediemonas membranifera]
KAG9393873.1	KAG9393873.1 tumor suppressor Mitostatin [Carpediemonas membranifera]
KAG9393874.1	KAG9393874.1 hypothetical protein J8273_4738 [Carpediemonas membranifera]
KAG9393875.1	KAG9393875.1 putative snoRNA binding domain [Carpediemonas membranifera]
KAG9393876.1	KAG9393876.1 ribosomal protein S12e [Carpediemonas membranifera]
KAG9393877.1	KAG9393877.1 hypothetical protein J8273_4741 [Carpediemonas membranifera]
KAG9393878.1	KAG9393878.1 hypothetical protein J8273_4742 [Carpediemonas membranifera]
KAG9393879.1	KAG9393879.1 TFIIH subunit Tfb4/p34 [Carpediemonas membranifera]
KAG9393880.1	KAG9393880.1 Chaperonin Cpn60/TCP-1 [Carpediemonas membranifera]
KAG9393881.1	KAG9393881.1 Chromosome partition protein Smc [Carpediemonas membranifera]
KAG9393882.1	KAG9393882.1 metal-dependent protein hydrolase [Carpediemonas membranifera]
KAG9393883.1	KAG9393883.1 Magnesium transporter NIPA [Carpediemonas membranifera]
KAG9393884.1	KAG9393884.1 RNase H [Carpediemonas membranifera]
KAG9393885.1	KAG9393885.1 hypothetical protein J8273_4749 [Carpediemonas membranifera]
KAG9393886.1	KAG9393886.1 Cytidylyltransferase [Carpediemonas membranifera]
KAG9393887.1	KAG9393887.1 Small GTPase superfamily ARF type [Carpediemonas membranifera]
KAG9393888.1	KAG9393888.1 hypothetical protein J8273_4752 [Carpediemonas membranifera]
KAG9393889.1	KAG9393889.1 hypothetical protein J8273_4753 [Carpediemonas membranifera]
KAG9393890.1	KAG9393890.1 Regulator of G protein signaling domain [Carpediemonas membranifera]
KAG9393891.1	KAG9393891.1 AMP-binding enzyme [Carpediemonas membranifera]
KAG9393892.1	KAG9393892.1 TPR repeat [Carpediemonas membranifera]
KAG9393893.1	KAG9393893.1 Protein disulfide isomerase [Carpediemonas membranifera]
KAG9393894.1	KAG9393894.1 Poly(A) polymerase central domain [Carpediemonas membranifera]
KAG9393895.1	KAG9393895.1 START domain [Carpediemonas membranifera]
KAG9393896.1	KAG9393896.1 Equilibrative nucleoside transporter [Carpediemonas membranifera]
KAG9393897.1	KAG9393897.1 RNA (C5-cytosine) methyltransferase, partial [Carpediemonas membranifera]
KAG9393898.1	KAG9393898.1 hypothetical protein J8273_4491 [Carpediemonas membranifera]
KAG9393899.1	KAG9393899.1 Acetyltransferase (GNAT) domain [Carpediemonas membranifera]
KAG9393900.1	KAG9393900.1 hypothetical protein J8273_4493 [Carpediemonas membranifera]
KAG9393901.1	KAG9393901.1 SET domain [Carpediemonas membranifera]
KAG9393902.1	KAG9393902.1 hypothetical protein J8273_4495 [Carpediemonas membranifera]
KAG9393903.1	KAG9393903.1 hypothetical protein J8273_4496 [Carpediemonas membranifera]
KAG9393904.1	KAG9393904.1 hypothetical protein J8273_4500 [Carpediemonas membranifera]
KAG9393905.1	KAG9393905.1 Retrotransposable element Tf2 155 kDa protein type 1 [Carpediemonas membranifera]
KAG9393906.1	KAG9393906.1 Chromo (CHRromatin Organization MOdifier) domain [Carpediemonas membranifera]
KAG9393907.1	KAG9393907.1 Zinc knuckle [Carpediemonas membranifera]
KAG9393908.1	KAG9393908.1 Chromo and chromo shadow domain [Carpediemonas membranifera]
KAG9393909.1	KAG9393909.1 C2 domain [Carpediemonas membranifera]
KAG9393910.1	KAG9393910.1 hypothetical protein J8273_4510 [Carpediemonas membranifera]
KAG9393911.1	KAG9393911.1 Double-stranded RNA binding motif [Carpediemonas membranifera]
KAG9393912.1	KAG9393912.1 Chromosome partition protein Smc [Carpediemonas membranifera]
KAG9393913.1	KAG9393913.1 Histidine phosphatase superfamily [Carpediemonas membranifera]
KAG9393914.1	KAG9393914.1 hypothetical protein J8273_4514 [Carpediemonas membranifera]
KAG9393915.1	KAG9393915.1 Ceroid-lipofuscinosis neuronal protein 5 [Carpediemonas membranifera]
KAG9393916.1	KAG9393916.1 hypothetical protein J8273_4516 [Carpediemonas membranifera]
KAG9393917.1	KAG9393917.1 Batten's disease protein Cln3 [Carpediemonas membranifera]
KAG9393918.1	KAG9393918.1 hypothetical protein J8273_4518 [Carpediemonas membranifera]
KAG9393919.1	KAG9393919.1 transmembrane-17 family protein [Carpediemonas membranifera]
KAG9393920.1	KAG9393920.1 hypothetical protein J8273_4520 [Carpediemonas membranifera]
KAG9393921.1	KAG9393921.1 Protein kinase domain [Carpediemonas membranifera]
KAG9393922.1	KAG9393922.1 Bromodomain-containing protein [Carpediemonas membranifera]
KAG9393923.1	KAG9393923.1 Polo-like kinase 1 [Carpediemonas membranifera]
KAG9393924.1	KAG9393924.1 NAD synthetase [Carpediemonas membranifera]
KAG9393925.1	KAG9393925.1 Mrp/NBP35 ATP-binding protein [Carpediemonas membranifera]
KAG9393926.1	KAG9393926.1 Chromosome partition protein Smc [Carpediemonas membranifera]
KAG9393927.1	KAG9393927.1 plasma membrane calcium ATPase [Carpediemonas membranifera]
KAG9393928.1	KAG9393928.1 hypothetical protein J8273_4528 [Carpediemonas membranifera]
KAG9393929.1	KAG9393929.1 Ankyrin repeats (3 copies) [Carpediemonas membranifera]
KAG9393930.1	KAG9393930.1 26S proteasome, regulatory subunit Rpn7 [Carpediemonas membranifera]
KAG9393931.1	KAG9393931.1 26S proteasome subunit P45 new pescadillo-like protein [Carpediemonas membranifera]
KAG9393932.1	KAG9393932.1 26S proteasome subunit P45-regulatory particle triple-A ATPase protein [Carpediemonas membranifera]
KAG9393933.1	KAG9393933.1 SHS2 domain found in N terminus of Rpb7p/Rpc25p/MJ0397 [Carpediemonas membranifera]
KAG9393934.1	KAG9393934.1 hypothetical protein J8273_4534 [Carpediemonas membranifera]
KAG9393935.1	KAG9393935.1 Prokaryotic membrane lipoprotein lipid attachment site [Carpediemonas membranifera]
KAG9393936.1	KAG9393936.1 WD domain, G-beta repeat [Carpediemonas membranifera]
KAG9393937.1	KAG9393937.1 tmcB-like protein [Carpediemonas membranifera]
KAG9393938.1	KAG9393938.1 importin subunit alpha-3-like [Carpediemonas membranifera]
KAG9393939.1	KAG9393939.1 hypothetical protein J8273_4539 [Carpediemonas membranifera]
KAG9393940.1	KAG9393940.1 Ribosomal protein L36e [Carpediemonas membranifera]
KAG9393941.1	KAG9393941.1 Mak16 protein [Carpediemonas membranifera]
KAG9393942.1	KAG9393942.1 WD domain, G-beta repeat [Carpediemonas membranifera]
KAG9393943.1	KAG9393943.1 Solute carrier family 35 member SLC35F1/F2/F6 [Carpediemonas membranifera]
KAG9393944.1	KAG9393944.1 hypothetical protein J8273_4544 [Carpediemonas membranifera]
KAG9393945.1	KAG9393945.1 Ribulose-phosphate 3-epimerase-like [Carpediemonas membranifera]
KAG9393946.1	KAG9393946.1 Acyltransferase [Carpediemonas membranifera]
KAG9393947.1	KAG9393947.1 Ribosomal protein S9 [Carpediemonas membranifera]
KAG9393948.1	KAG9393948.1 Phospholipase B-like [Carpediemonas membranifera]
KAG9393949.1	KAG9393949.1 hypothetical protein J8273_4549 [Carpediemonas membranifera]
KAG9393950.1	KAG9393950.1 Uncharacterized protein family UPF0001 [Carpediemonas membranifera]
KAG9393951.1	KAG9393951.1 hypothetical protein J8273_4551 [Carpediemonas membranifera]
KAG9393952.1	KAG9393952.1 Sec7 domain [Carpediemonas membranifera]
KAG9393953.1	KAG9393953.1 hypothetical protein J8273_4553 [Carpediemonas membranifera]
KAG9393954.1	KAG9393954.1 Iron-only hydrogenase [Carpediemonas membranifera]
KAG9393955.1	KAG9393955.1 Zinc finger C-x8-C-x5-C-x3-H type (and similar) [Carpediemonas membranifera]
KAG9393956.1	KAG9393956.1 hypothetical protein J8273_4556 [Carpediemonas membranifera]
KAG9393957.1	KAG9393957.1 Membrane bound O-acyl transferase, MBOAT [Carpediemonas membranifera]
KAG9393958.1	KAG9393958.1 hypothetical protein J8273_4558 [Carpediemonas membranifera]
KAG9393959.1	KAG9393959.1 ABC transporter subfamily A-like [Carpediemonas membranifera]
KAG9393960.1	KAG9393960.1 hypothetical protein J8273_4560 [Carpediemonas membranifera]
KAG9393961.1	KAG9393961.1 UDP-glucose 4-epimerase GalE [Carpediemonas membranifera]
KAG9393962.1	KAG9393962.1 hypothetical protein J8273_4562 [Carpediemonas membranifera]
KAG9393963.1	KAG9393963.1 vacuolar sorting protein 9 domain-containing protein [Carpediemonas membranifera]
KAG9393964.1	KAG9393964.1 importin family nuclear export receptor Crm1 [Carpediemonas membranifera]
KAG9393965.1	KAG9393965.1 Importin subunit alpha [Carpediemonas membranifera]
KAG9393966.1	KAG9393966.1 Mitochondrial biogenesis protein AIM24 [Carpediemonas membranifera]
KAG9393967.1	KAG9393967.1 Cytochrome b5-like Heme/Steroid binding domain [Carpediemonas membranifera]
KAG9393968.1	KAG9393968.1 Zinc carboxypeptidase [Carpediemonas membranifera]
KAG9393969.1	KAG9393969.1 Uncharacterized protein family UPF0538 [Carpediemonas membranifera]
KAG9393970.1	KAG9393970.1 Mitochondrial Hsp70 [Carpediemonas membranifera]
KAG9393971.1	KAG9393971.1 hypothetical protein J8273_4571 [Carpediemonas membranifera]
KAG9393972.1	KAG9393972.1 hypothetical protein J8273_4572 [Carpediemonas membranifera]
KAG9393973.1	KAG9393973.1 Atrazine chlorohydrolase [Carpediemonas membranifera]
KAG9393974.1	KAG9393974.1 viral IAP-associated factor [Carpediemonas membranifera]
KAG9393975.1	KAG9393975.1 putative chromatin modifying protein 1b [Carpediemonas membranifera]
KAG9393976.1	KAG9393976.1 Vacuolar 14 Fab1-binding region [Carpediemonas membranifera]
