id	desc
KAG9395496.1	KAG9395496.1 Nuclear transport factor 2 (NTF2) domain [Carpediemonas membranifera]
KAG9395497.1	KAG9395497.1 La domain [Carpediemonas membranifera]
KAG9395498.1	KAG9395498.1 hypothetical protein J8273_3074 [Carpediemonas membranifera]
KAG9395499.1	KAG9395499.1 hypothetical protein J8273_3075 [Carpediemonas membranifera]
KAG9395500.1	KAG9395500.1 40S RIBOSOMAL PROTEIN S29 [Carpediemonas membranifera]
KAG9395501.1	KAG9395501.1 UTP--glucose-1-phosphate uridylyltransferase family [Carpediemonas membranifera]
KAG9395502.1	KAG9395502.1 Aminoacyl-tRNA synthetase class Ic [Carpediemonas membranifera]
KAG9395503.1	KAG9395503.1 hypothetical protein J8273_3079 [Carpediemonas membranifera]
KAG9395504.1	KAG9395504.1 Sas10/Utp3/C1D [Carpediemonas membranifera]
KAG9395505.1	KAG9395505.1 Glycerol kinase [Carpediemonas membranifera]
KAG9395506.1	KAG9395506.1 Copine [Carpediemonas membranifera]
KAG9395507.1	KAG9395507.1 hypothetical protein J8273_3083 [Carpediemonas membranifera]
KAG9395508.1	KAG9395508.1 Hydroxyacylglutathione hydrolase [Carpediemonas membranifera]
KAG9395509.1	KAG9395509.1 Hydroxyacylglutathione hydrolase [Carpediemonas membranifera]
KAG9395510.1	KAG9395510.1 putative death-receptor fusion protein (DUF2428) [Carpediemonas membranifera]
KAG9395511.1	KAG9395511.1 hypothetical protein J8273_3087 [Carpediemonas membranifera]
KAG9395512.1	KAG9395512.1 Chaperone DnaJ [Carpediemonas membranifera]
KAG9395513.1	KAG9395513.1 WD domain G-beta repeat [Carpediemonas membranifera]
KAG9395514.1	KAG9395514.1 RNA recognition motif containing protein [Carpediemonas membranifera]
KAG9395515.1	KAG9395515.1 hypothetical protein J8273_3091 [Carpediemonas membranifera]
KAG9395516.1	KAG9395516.1 Clathrin heavy chain [Carpediemonas membranifera]
KAG9395517.1	KAG9395517.1 endodeoxyribonuclease RusA family protein [Carpediemonas membranifera]
KAG9395518.1	KAG9395518.1 hypothetical protein J8273_3094 [Carpediemonas membranifera]
KAG9395519.1	KAG9395519.1 hypothetical protein J8273_3095 [Carpediemonas membranifera]
KAG9395520.1	KAG9395520.1 Serpin (serine protease inhibitor) [Carpediemonas membranifera]
KAG9395521.1	KAG9395521.1 Calcineurin-like phosphoesterase [Carpediemonas membranifera]
KAG9395522.1	KAG9395522.1 Regulator of G protein signaling domain [Carpediemonas membranifera]
KAG9395523.1	KAG9395523.1 Chromosome partition protein Smc [Carpediemonas membranifera]
KAG9395524.1	KAG9395524.1 tumor suppressor Mitostatin [Carpediemonas membranifera]
KAG9395525.1	KAG9395525.1 hypothetical protein J8273_3101 [Carpediemonas membranifera]
KAG9395526.1	KAG9395526.1 MYCBP-associated protein family [Carpediemonas membranifera]
KAG9395527.1	KAG9395527.1 hypothetical protein J8273_3103 [Carpediemonas membranifera]
KAG9395528.1	KAG9395528.1 Chaperonin Cpn60/TCP-1 [Carpediemonas membranifera]
KAG9395529.1	KAG9395529.1 hypothetical protein J8273_3105 [Carpediemonas membranifera]
KAG9395530.1	KAG9395530.1 hypothetical protein J8273_3106 [Carpediemonas membranifera]
KAG9395531.1	KAG9395531.1 Pyridoxal-phosphate dependent enzyme [Carpediemonas membranifera]
KAG9395532.1	KAG9395532.1 chromosome segregation protein [Carpediemonas membranifera]
KAG9395533.1	KAG9395533.1 hypothetical protein J8273_3109 [Carpediemonas membranifera]
KAG9395534.1	KAG9395534.1 FHA domain [Carpediemonas membranifera]
KAG9395535.1	KAG9395535.1 Chromosome partition protein Smc [Carpediemonas membranifera]
KAG9395536.1	KAG9395536.1 Sedlin [Carpediemonas membranifera]
KAG9395537.1	KAG9395537.1 ATPase family associated with various cellular activities (AAA) [Carpediemonas membranifera]
KAG9395538.1	KAG9395538.1 pyridoxal-5-phosphate-dependent protein subunit beta [Carpediemonas membranifera]
KAG9395539.1	KAG9395539.1 Chromosome partition protein Smc [Carpediemonas membranifera]
KAG9395540.1	KAG9395540.1 transcription factor PCL1 [Carpediemonas membranifera]
KAG9395541.1	KAG9395541.1 hypothetical protein J8273_3117 [Carpediemonas membranifera]
KAG9395542.1	KAG9395542.1 D-tyrosyl-tRNA(Tyr) deacylase [Carpediemonas membranifera]
KAG9395543.1	KAG9395543.1 hypothetical protein J8273_3119 [Carpediemonas membranifera]
KAG9395544.1	KAG9395544.1 Chromosome partition protein Smc [Carpediemonas membranifera]
KAG9395545.1	KAG9395545.1 hypothetical protein J8273_3121 [Carpediemonas membranifera]
KAG9395546.1	KAG9395546.1 Gamma-tubulin complex component protein [Carpediemonas membranifera]
KAG9395547.1	KAG9395547.1 Proteasome subunit alpha/beta [Carpediemonas membranifera]
KAG9395548.1	KAG9395548.1 hypothetical protein J8273_3124 [Carpediemonas membranifera]
KAG9395549.1	KAG9395549.1 hypothetical protein J8273_3126 [Carpediemonas membranifera]
KAG9395550.1	KAG9395550.1 Chromosome partition protein Smc [Carpediemonas membranifera]
KAG9395551.1	KAG9395551.1 hypothetical protein J8273_3128 [Carpediemonas membranifera]
KAG9395552.1	KAG9395552.1 O-sialoglycoprotein endopeptidase [Carpediemonas membranifera]
KAG9395553.1	KAG9395553.1 hypothetical protein J8273_3130 [Carpediemonas membranifera]
KAG9395554.1	KAG9395554.1 ras-related protein Rab-5B [Carpediemonas membranifera]
KAG9395555.1	KAG9395555.1 hypothetical protein J8273_3132 [Carpediemonas membranifera]
KAG9395556.1	KAG9395556.1 hypothetical protein J8273_3133 [Carpediemonas membranifera]
KAG9395557.1	KAG9395557.1 hypothetical protein J8273_3134 [Carpediemonas membranifera]
KAG9395558.1	KAG9395558.1 hypothetical protein J8273_3136 [Carpediemonas membranifera]
KAG9395559.1	KAG9395559.1 TM2 domain containing protein [Carpediemonas membranifera]
KAG9395560.1	KAG9395560.1 hypothetical protein J8273_3138 [Carpediemonas membranifera]
KAG9395561.1	KAG9395561.1 hypothetical protein J8273_3139 [Carpediemonas membranifera]
KAG9395562.1	KAG9395562.1 TLC domain [Carpediemonas membranifera]
KAG9395563.1	KAG9395563.1 hypothetical protein J8273_3141 [Carpediemonas membranifera]
KAG9395564.1	KAG9395564.1 Protein kinase domain [Carpediemonas membranifera]
KAG9395565.1	KAG9395565.1 Leucine Rich repeats (2 copies) [Carpediemonas membranifera]
KAG9395566.1	KAG9395566.1 Chromosome partition protein Smc [Carpediemonas membranifera]
KAG9395567.1	KAG9395567.1 Chromosome partition protein Smc [Carpediemonas membranifera]
KAG9395568.1	KAG9395568.1 Chromosome partition protein Smc [Carpediemonas membranifera]
KAG9395569.1	KAG9395569.1 hypothetical protein J8273_3147 [Carpediemonas membranifera]
KAG9395570.1	KAG9395570.1 hypothetical protein J8273_3152 [Carpediemonas membranifera]
KAG9395571.1	KAG9395571.1 hypothetical protein J8273_3153 [Carpediemonas membranifera]
KAG9395572.1	KAG9395572.1 Isoleucine-tRNA ligase [Carpediemonas membranifera]
KAG9395573.1	KAG9395573.1 Glucosamine-6-phosphate deaminase [Carpediemonas membranifera]
KAG9395574.1	KAG9395574.1 hypothetical protein J8273_3156 [Carpediemonas membranifera]
KAG9395575.1	KAG9395575.1 cyclin-dependent kinase 3 [Carpediemonas membranifera]
KAG9395576.1	KAG9395576.1 Ribosomal protein S5, eukaryotic/archaeal [Carpediemonas membranifera]
KAG9395577.1	KAG9395577.1 WRKY DNA -binding domain [Carpediemonas membranifera]
KAG9395578.1	KAG9395578.1 Riboflavin kinase [Carpediemonas membranifera]
KAG9395579.1	KAG9395579.1 Meiotic nuclear division protein 1 [Carpediemonas membranifera]
KAG9395580.1	KAG9395580.1 zinc-finger of a C2HC-type [Carpediemonas membranifera]
KAG9395581.1	KAG9395581.1 Chromosome partition protein Smc [Carpediemonas membranifera]
KAG9395582.1	KAG9395582.1 Beige/BEACH domain [Carpediemonas membranifera]
KAG9395583.1	KAG9395583.1 hypothetical protein J8273_3165 [Carpediemonas membranifera]
KAG9395584.1	KAG9395584.1 Zinc finger CCHC-type [Carpediemonas membranifera]
KAG9395585.1	KAG9395585.1 NLI interacting factor-like phosphatase [Carpediemonas membranifera]
KAG9395586.1	KAG9395586.1 hypothetical protein J8273_2781 [Carpediemonas membranifera]
KAG9395587.1	KAG9395587.1 hypothetical protein J8273_2782 [Carpediemonas membranifera]
KAG9395588.1	KAG9395588.1 emp24/gp25L/p24 family/GOLD [Carpediemonas membranifera]
KAG9395589.1	KAG9395589.1 hypothetical protein J8273_2784 [Carpediemonas membranifera]
KAG9395590.1	KAG9395590.1 hypothetical protein J8273_2785 [Carpediemonas membranifera]
KAG9395591.1	KAG9395591.1 Alpha amylase, catalytic domain [Carpediemonas membranifera]
KAG9395592.1	KAG9395592.1 MAC/Perforin domain [Carpediemonas membranifera]
KAG9395593.1	KAG9395593.1 Protein kinase domain [Carpediemonas membranifera]
KAG9395594.1	KAG9395594.1 hypothetical protein J8273_2789 [Carpediemonas membranifera]
KAG9395595.1	KAG9395595.1 hypothetical protein J8273_2790 [Carpediemonas membranifera]
KAG9395596.1	KAG9395596.1 Mitochondrial inner membrane translocase subunit Tim17/Tim22/Tim23 [Carpediemonas membranifera]
KAG9395597.1	KAG9395597.1 Ribosomal protein L29 [Carpediemonas membranifera]
KAG9395598.1	KAG9395598.1 DEAD/DEAH box helicase [Carpediemonas membranifera]
KAG9395599.1	KAG9395599.1 Dephospho-CoA kinase [Carpediemonas membranifera]
KAG9395600.1	KAG9395600.1 Nudix hydrolase domain [Carpediemonas membranifera]
KAG9395601.1	KAG9395601.1 hypothetical protein J8273_2796 [Carpediemonas membranifera]
KAG9395602.1	KAG9395602.1 Transmembrane protein TauE like [Carpediemonas membranifera]
KAG9395603.1	KAG9395603.1 Calcineurin-like phosphoesterase [Carpediemonas membranifera]
KAG9395604.1	KAG9395604.1 Chromosome partition protein Smc [Carpediemonas membranifera]
KAG9395605.1	KAG9395605.1 Cysteine synthase B [Carpediemonas membranifera]
KAG9395606.1	KAG9395606.1 ARP2/3 complex, 34kDa subunit (p34-Arc) [Carpediemonas membranifera]
KAG9395607.1	KAG9395607.1 Enolase [Carpediemonas membranifera]
KAG9395608.1	KAG9395608.1 Protein of unknown function DUF229 [Carpediemonas membranifera]
KAG9395609.1	KAG9395609.1 Beige/BEACH domain [Carpediemonas membranifera]
KAG9395610.1	KAG9395610.1 Brix domain [Carpediemonas membranifera]
KAG9395611.1	KAG9395611.1 Ruv-B like helicase, RUVBL1 [Carpediemonas membranifera]
KAG9395612.1	KAG9395612.1 hypothetical protein J8273_2807 [Carpediemonas membranifera]
KAG9395613.1	KAG9395613.1 short-chain dehydrogenase [Carpediemonas membranifera]
KAG9395614.1	KAG9395614.1 NADP-specific glutamate dehydrogenase [Carpediemonas membranifera]
KAG9395615.1	KAG9395615.1 NADP-specific glutamate dehydrogenase [Carpediemonas membranifera]
KAG9395616.1	KAG9395616.1 hypothetical protein J8273_2811 [Carpediemonas membranifera]
KAG9395617.1	KAG9395617.1 SNARE domain [Carpediemonas membranifera]
KAG9395618.1	KAG9395618.1 hypothetical protein J8273_2813 [Carpediemonas membranifera]
KAG9395619.1	KAG9395619.1 RNA polymerase, subunit omega/K/RPB6 [Carpediemonas membranifera]
KAG9395620.1	KAG9395620.1 hypothetical protein J8273_2815 [Carpediemonas membranifera]
KAG9395621.1	KAG9395621.1 Dpy-30 motif [Carpediemonas membranifera]
KAG9395622.1	KAG9395622.1 C2 domain of PTEN tumor-suppressor protein [Carpediemonas membranifera]
KAG9395623.1	KAG9395623.1 hypothetical protein J8273_2818 [Carpediemonas membranifera]
KAG9395624.1	KAG9395624.1 hypothetical protein J8273_2819 [Carpediemonas membranifera]
KAG9395625.1	KAG9395625.1 hypothetical protein J8273_2820 [Carpediemonas membranifera]
KAG9395626.1	KAG9395626.1 Chromosome partition protein Smc [Carpediemonas membranifera]
KAG9395627.1	KAG9395627.1 hypothetical protein J8273_2825 [Carpediemonas membranifera]
KAG9395628.1	KAG9395628.1 hypothetical protein J8273_2826 [Carpediemonas membranifera]
KAG9395629.1	KAG9395629.1 CAAX amino terminal protease [Carpediemonas membranifera]
KAG9395630.1	KAG9395630.1 hypothetical protein J8273_2828 [Carpediemonas membranifera]
KAG9395631.1	KAG9395631.1 hypothetical protein J8273_2830 [Carpediemonas membranifera]
KAG9395632.1	KAG9395632.1 Zinc knuckle [Carpediemonas membranifera]
KAG9395633.1	KAG9395633.1 polyprotein [Carpediemonas membranifera]
KAG9395634.1	KAG9395634.1 hypothetical protein J8273_2837 [Carpediemonas membranifera]
KAG9395635.1	KAG9395635.1 hypothetical protein J8273_2839 [Carpediemonas membranifera]
KAG9395636.1	KAG9395636.1 Vps16, C-terminal region [Carpediemonas membranifera]
KAG9395637.1	KAG9395637.1 GRIP domain [Carpediemonas membranifera]
KAG9395638.1	KAG9395638.1 Leucine Rich repeats (2 copies) [Carpediemonas membranifera]
KAG9395639.1	KAG9395639.1 RNA recognition motif [Carpediemonas membranifera]
KAG9395640.1	KAG9395640.1 hypothetical protein J8273_2844 [Carpediemonas membranifera]
KAG9395641.1	KAG9395641.1 Histone acetyltransferase ELP3 [Carpediemonas membranifera]
KAG9395642.1	KAG9395642.1 Inositol phosphatase [Carpediemonas membranifera]
KAG9395643.1	KAG9395643.1 Src 3 (SH3) domain [Carpediemonas membranifera]
KAG9395644.1	KAG9395644.1 hypothetical protein J8273_2848 [Carpediemonas membranifera]
KAG9395645.1	KAG9395645.1 hypothetical protein J8273_2849 [Carpediemonas membranifera]
KAG9395646.1	KAG9395646.1 Cyclin, N-terminal domain [Carpediemonas membranifera]
KAG9395647.1	KAG9395647.1 hypothetical protein J8273_2851 [Carpediemonas membranifera]
KAG9395648.1	KAG9395648.1 Prefoldin subunit [Carpediemonas membranifera]
KAG9395649.1	KAG9395649.1 Ribosomal protein L18/L5 [Carpediemonas membranifera]
KAG9395650.1	KAG9395650.1 WD domain, G-beta repeat [Carpediemonas membranifera]
KAG9395651.1	KAG9395651.1 FG-GAP repeat [Carpediemonas membranifera]
KAG9395652.1	KAG9395652.1 Dedicator of cytokinesis [Carpediemonas membranifera]
KAG9395653.1	KAG9395653.1 WD domain, G-beta repeat [Carpediemonas membranifera]
KAG9395654.1	KAG9395654.1 Adaptin ear-binding coat-associated protein 1 NECAP-1 [Carpediemonas membranifera]
KAG9395655.1	KAG9395655.1 hypothetical protein J8273_2859 [Carpediemonas membranifera]
KAG9395656.1	KAG9395656.1 hypothetical protein J8273_2860 [Carpediemonas membranifera]
KAG9395657.1	KAG9395657.1 hypothetical protein J8273_2861 [Carpediemonas membranifera]
KAG9395658.1	KAG9395658.1 Ubiquitin domain [Carpediemonas membranifera]
KAG9395659.1	KAG9395659.1 Leucine Rich repeats (2 copies) [Carpediemonas membranifera]
KAG9395660.1	KAG9395660.1 Tubulin [Carpediemonas membranifera]
KAG9395661.1	KAG9395661.1 hypothetical protein J8273_2865 [Carpediemonas membranifera]
KAG9395662.1	KAG9395662.1 Cyclin, N-terminal domain [Carpediemonas membranifera]
KAG9395663.1	KAG9395663.1 hypothetical protein J8273_2867 [Carpediemonas membranifera]
KAG9395664.1	KAG9395664.1 Glycosyl transferase, family 8 [Carpediemonas membranifera]
KAG9395665.1	KAG9395665.1 hypothetical protein J8273_2869 [Carpediemonas membranifera]
KAG9395666.1	KAG9395666.1 hypothetical protein J8273_2870 [Carpediemonas membranifera]
KAG9395667.1	KAG9395667.1 hypothetical protein J8273_2871 [Carpediemonas membranifera]
KAG9395668.1	KAG9395668.1 Na+/H+ exchanger [Carpediemonas membranifera]
KAG9395669.1	KAG9395669.1 Dcp2, box A domain [Carpediemonas membranifera]
KAG9395670.1	KAG9395670.1 Parkin co-regulated protein [Carpediemonas membranifera]
KAG9395671.1	KAG9395671.1 putative aspartyl protease family A01A [Carpediemonas membranifera]
KAG9395672.1	KAG9395672.1 Ribosomal protein L4/L1e [Carpediemonas membranifera]
KAG9395673.1	KAG9395673.1 hypothetical protein J8273_2877 [Carpediemonas membranifera]
KAG9395674.1	KAG9395674.1 LSM domain [Carpediemonas membranifera]
KAG9395675.1	KAG9395675.1 hypothetical protein J8273_2879 [Carpediemonas membranifera]
KAG9395676.1	KAG9395676.1 Sorting and assembly machinery subunit 50kDa subunit SAM50 [Carpediemonas membranifera]
KAG9395677.1	KAG9395677.1 hypothetical protein J8273_2881 [Carpediemonas membranifera]
KAG9395678.1	KAG9395678.1 transcription factor PCL1 [Carpediemonas membranifera]
KAG9395679.1	KAG9395679.1 hypothetical protein J8273_2883 [Carpediemonas membranifera]
KAG9395680.1	KAG9395680.1 Ras GTPase activation domain-containing protein [Carpediemonas membranifera]
KAG9395681.1	KAG9395681.1 Eukaryotic porin/Tom40 [Carpediemonas membranifera]
KAG9395682.1	KAG9395682.1 ABC transporter transmembrane region 2 [Carpediemonas membranifera]
KAG9395683.1	KAG9395683.1 Protein kinase domain [Carpediemonas membranifera]
KAG9395684.1	KAG9395684.1 Protein TolA [Carpediemonas membranifera]
KAG9395685.1	KAG9395685.1 hypothetical protein J8273_2889 [Carpediemonas membranifera]
KAG9395686.1	KAG9395686.1 CDP-alcohol phosphatidyltransferase [Carpediemonas membranifera]
KAG9395687.1	KAG9395687.1 Protein kinase domain [Carpediemonas membranifera]
KAG9395688.1	KAG9395688.1 SNF2-family ATP dependent chromatin remodeling factor snf21 [Carpediemonas membranifera]
KAG9395689.1	KAG9395689.1 Selenide water dikinase [Carpediemonas membranifera]
KAG9395690.1	KAG9395690.1 RNA recognition motif [Carpediemonas membranifera]
KAG9395691.1	KAG9395691.1 JAB1/Mov34/MPN/PAD-1 ubiquitin protease [Carpediemonas membranifera]
KAG9395692.1	KAG9395692.1 hypothetical protein J8273_2896 [Carpediemonas membranifera]
KAG9395693.1	KAG9395693.1 Trp-Asp (WD) repeats circular [Carpediemonas membranifera]
KAG9395694.1	KAG9395694.1 hypothetical protein J8273_2898 [Carpediemonas membranifera]
KAG9395695.1	KAG9395695.1 bis(5'-adenosyl)-triphosphatase [Carpediemonas membranifera]
KAG9395696.1	KAG9395696.1 hypothetical protein J8273_2900 [Carpediemonas membranifera]
KAG9395697.1	KAG9395697.1 50S ribosome-binding GTPase [Carpediemonas membranifera]
KAG9395698.1	KAG9395698.1 Cdc14 phosphatase binding protein N-terminus [Carpediemonas membranifera]
KAG9395699.1	KAG9395699.1 hypothetical protein J8273_2903 [Carpediemonas membranifera]
KAG9395700.1	KAG9395700.1 ABC transporter subfamily B member 10-like [Carpediemonas membranifera]
KAG9395701.1	KAG9395701.1 Farnesyl pyrophosphate synthase [Carpediemonas membranifera]
KAG9395702.1	KAG9395702.1 SNARE domain [Carpediemonas membranifera]
KAG9395703.1	KAG9395703.1 Chromo (CHRromatin Organization MOdifier) domain [Carpediemonas membranifera]
KAG9395704.1	KAG9395704.1 hypothetical protein J8273_2908 [Carpediemonas membranifera]
KAG9395705.1	KAG9395705.1 Splicing factor U2AF [Carpediemonas membranifera]
KAG9395706.1	KAG9395706.1 enzymatic polyprotein [Carpediemonas membranifera]
KAG9395707.1	KAG9395707.1 AMP-binding enzyme, partial [Carpediemonas membranifera]
KAG9395708.1	KAG9395708.1 hypothetical protein J8273_2614 [Carpediemonas membranifera]
KAG9395709.1	KAG9395709.1 Prokaryotic membrane lipoprotein lipid attachment site [Carpediemonas membranifera]
KAG9395710.1	KAG9395710.1 hypothetical protein J8273_2616 [Carpediemonas membranifera]
KAG9395711.1	KAG9395711.1 hypothetical protein J8273_2617 [Carpediemonas membranifera]
KAG9395712.1	KAG9395712.1 GTPase-activator protein for Ras-like GTPase [Carpediemonas membranifera]
KAG9395713.1	KAG9395713.1 Histone deacetylase superfamily [Carpediemonas membranifera]
KAG9395714.1	KAG9395714.1 hypothetical protein J8273_2621 [Carpediemonas membranifera]
KAG9395715.1	KAG9395715.1 Tyrosyl-DNA phosphodiesterase I [Carpediemonas membranifera]
KAG9395716.1	KAG9395716.1 Adenylate and Guanylate cyclase catalytic domain [Carpediemonas membranifera]
KAG9395717.1	KAG9395717.1 hypothetical protein J8273_2624 [Carpediemonas membranifera]
KAG9395718.1	KAG9395718.1 Smr domain [Carpediemonas membranifera]
KAG9395719.1	KAG9395719.1 hypothetical protein J8273_2626 [Carpediemonas membranifera]
KAG9395720.1	KAG9395720.1 hypothetical protein J8273_2627 [Carpediemonas membranifera]
KAG9395721.1	KAG9395721.1 histone acetyltransferase type B subunit 2 [Carpediemonas membranifera]
KAG9395722.1	KAG9395722.1 Protein kinase domain [Carpediemonas membranifera]
KAG9395723.1	KAG9395723.1 Tetratricopeptide repeat [Carpediemonas membranifera]
KAG9395724.1	KAG9395724.1 Brix domain [Carpediemonas membranifera]
KAG9395725.1	KAG9395725.1 Chromosome partition protein Smc [Carpediemonas membranifera]
KAG9395726.1	KAG9395726.1 Ceramide glucosyltransferase [Carpediemonas membranifera]
KAG9395727.1	KAG9395727.1 Chromosome partition protein Smc [Carpediemonas membranifera]
KAG9395728.1	KAG9395728.1 Sedlin [Carpediemonas membranifera]
KAG9395729.1	KAG9395729.1 PWWP domain [Carpediemonas membranifera]
KAG9395730.1	KAG9395730.1 hypothetical protein J8273_2637 [Carpediemonas membranifera]
KAG9395731.1	KAG9395731.1 Small-subunit processome Utp14 [Carpediemonas membranifera]
KAG9395732.1	KAG9395732.1 Bromodomain [Carpediemonas membranifera]
KAG9395733.1	KAG9395733.1 WD domain G-beta repeat [Carpediemonas membranifera]
KAG9395734.1	KAG9395734.1 hypothetical protein J8273_2641 [Carpediemonas membranifera]
KAG9395735.1	KAG9395735.1 SAC3/GANP/Nin1/mts3/eIF-3 p25 [Carpediemonas membranifera]
KAG9395736.1	KAG9395736.1 hypothetical protein J8273_2643 [Carpediemonas membranifera]
KAG9395737.1	KAG9395737.1 WH2 domain [Carpediemonas membranifera]
KAG9395738.1	KAG9395738.1 hypothetical protein J8273_2645 [Carpediemonas membranifera]
KAG9395739.1	KAG9395739.1 Papain family cysteine protease [Carpediemonas membranifera]
KAG9395740.1	KAG9395740.1 WD domain G-beta repeat [Carpediemonas membranifera]
KAG9395741.1	KAG9395741.1 TPR repeat region circular [Carpediemonas membranifera]
KAG9395742.1	KAG9395742.1 Ribosomal protein S8e/ribosomal biogenesis NSA2 [Carpediemonas membranifera]
KAG9395743.1	KAG9395743.1 hypothetical protein J8273_2650 [Carpediemonas membranifera]
KAG9395744.1	KAG9395744.1 Cdc20-like [Carpediemonas membranifera]
KAG9395745.1	KAG9395745.1 Protein kinase domain [Carpediemonas membranifera]
KAG9395746.1	KAG9395746.1 hypothetical protein J8273_2653 [Carpediemonas membranifera]
KAG9395747.1	KAG9395747.1 Dynein heavy chain and region D6 of dynein motor [Carpediemonas membranifera]
KAG9395748.1	KAG9395748.1 WD domain G-beta repeat [Carpediemonas membranifera]
KAG9395749.1	KAG9395749.1 Ornithine/DAP/Arg decarboxylase [Carpediemonas membranifera]
KAG9395750.1	KAG9395750.1 chromosome segregation protein [Carpediemonas membranifera]
KAG9395751.1	KAG9395751.1 WD domain G-beta repeat [Carpediemonas membranifera]
KAG9395752.1	KAG9395752.1 Papain family cysteine protease [Carpediemonas membranifera]
KAG9395753.1	KAG9395753.1 Phosphoacetylglucosamine mutase [Carpediemonas membranifera]
KAG9395754.1	KAG9395754.1 Beta-lysine N-acetyltransferase [Carpediemonas membranifera]
KAG9395755.1	KAG9395755.1 hypothetical protein J8273_2662 [Carpediemonas membranifera]
KAG9395756.1	KAG9395756.1 Papain family cysteine protease [Carpediemonas membranifera]
KAG9395757.1	KAG9395757.1 hypothetical protein J8273_2665 [Carpediemonas membranifera]
KAG9395758.1	KAG9395758.1 Zinc finger CCHC-type [Carpediemonas membranifera]
KAG9395759.1	KAG9395759.1 DNA polymerase zeta catalityc subunit DPOZ [Carpediemonas membranifera]
KAG9395760.1	KAG9395760.1 hypothetical protein J8273_2672 [Carpediemonas membranifera]
KAG9395761.1	KAG9395761.1 Homeobox KN domain [Carpediemonas membranifera]
KAG9395762.1	KAG9395762.1 Prokaryotic membrane lipoprotein lipid attachment site [Carpediemonas membranifera]
KAG9395763.1	KAG9395763.1 hypothetical protein J8273_2675 [Carpediemonas membranifera]
KAG9395764.1	KAG9395764.1 Organic solute carrier protein 1 [Carpediemonas membranifera]
KAG9395765.1	KAG9395765.1 hypothetical protein J8273_2677 [Carpediemonas membranifera]
KAG9395766.1	KAG9395766.1 NSF attachment protein [Carpediemonas membranifera]
KAG9395767.1	KAG9395767.1 TM2 domain [Carpediemonas membranifera]
KAG9395768.1	KAG9395768.1 Metallo-beta-lactamase superfamily [Carpediemonas membranifera]
KAG9395769.1	KAG9395769.1 Chromosome partition protein Smc [Carpediemonas membranifera]
KAG9395770.1	KAG9395770.1 hypothetical protein J8273_2682 [Carpediemonas membranifera]
KAG9395771.1	KAG9395771.1 Thioredoxin [Carpediemonas membranifera]
KAG9395772.1	KAG9395772.1 hypothetical protein J8273_2684 [Carpediemonas membranifera]
KAG9395773.1	KAG9395773.1 hypothetical protein J8273_2685 [Carpediemonas membranifera]
KAG9395774.1	KAG9395774.1 Snf7 [Carpediemonas membranifera]
KAG9395775.1	KAG9395775.1 putative serine esterase (DUF676) [Carpediemonas membranifera]
KAG9395776.1	KAG9395776.1 Gamma interferon inducible lysosomal thiol reductase GILT [Carpediemonas membranifera]
KAG9395777.1	KAG9395777.1 Aminotransferase class I and II [Carpediemonas membranifera]
KAG9395778.1	KAG9395778.1 hypothetical protein J8273_2690 [Carpediemonas membranifera]
KAG9395779.1	KAG9395779.1 hypothetical protein J8273_2691 [Carpediemonas membranifera]
KAG9395780.1	KAG9395780.1 hypothetical protein J8273_2692 [Carpediemonas membranifera]
KAG9395781.1	KAG9395781.1 CUB domain [Carpediemonas membranifera]
KAG9395782.1	KAG9395782.1 hypothetical protein J8273_2694 [Carpediemonas membranifera]
KAG9395783.1	KAG9395783.1 hypothetical protein J8273_2695 [Carpediemonas membranifera]
KAG9395784.1	KAG9395784.1 Armadillo/beta-catenin-like repeat [Carpediemonas membranifera]
KAG9395785.1	KAG9395785.1 hypothetical protein J8273_2697 [Carpediemonas membranifera]
KAG9395786.1	KAG9395786.1 Protein tyrosine kinase [Carpediemonas membranifera]
KAG9395787.1	KAG9395787.1 Peptidase family M28 [Carpediemonas membranifera]
KAG9395788.1	KAG9395788.1 Ribosomal protein L7Ae/L8/Nhp2 family [Carpediemonas membranifera]
KAG9395789.1	KAG9395789.1 Ion channel [Carpediemonas membranifera]
KAG9395790.1	KAG9395790.1 WD domain G-beta repeat [Carpediemonas membranifera]
KAG9395791.1	KAG9395791.1 hypothetical protein J8273_2703 [Carpediemonas membranifera]
KAG9395792.1	KAG9395792.1 hypothetical protein J8273_2704 [Carpediemonas membranifera]
KAG9395793.1	KAG9395793.1 Cyclin N-terminal domain [Carpediemonas membranifera]
KAG9395794.1	KAG9395794.1 ADP-ribosylation/Crystallin J1 [Carpediemonas membranifera]
KAG9395795.1	KAG9395795.1 Secretion Associated Ras Related [Carpediemonas membranifera]
KAG9395796.1	KAG9395796.1 chromosome segregation protein [Carpediemonas membranifera]
KAG9395797.1	KAG9395797.1 hypothetical protein J8273_2709 [Carpediemonas membranifera]
KAG9395798.1	KAG9395798.1 Regulator of chromosome condensation (RCC1) repeat [Carpediemonas membranifera]
KAG9395799.1	KAG9395799.1 hypothetical protein J8273_2711 [Carpediemonas membranifera]
KAG9395800.1	KAG9395800.1 Colon cancer-associated protein Mic1-like [Carpediemonas membranifera]
KAG9395801.1	KAG9395801.1 ER lumen protein retaining receptor [Carpediemonas membranifera]
