id	desc
KAG9389427.1	KAG9389427.1 Chromosome partition protein Smc [Carpediemonas membranifera]
KAG9389428.1	KAG9389428.1 hypothetical protein J8273_8715 [Carpediemonas membranifera]
KAG9389429.1	KAG9389429.1 Chromo (CHRromatin Organization MOdifier) domain [Carpediemonas membranifera]
KAG9389430.1	KAG9389430.1 Endonuclease/Exonuclease/phosphatase family [Carpediemonas membranifera]
KAG9389431.1	KAG9389431.1 hypothetical protein J8273_8721 [Carpediemonas membranifera]
KAG9389432.1	KAG9389432.1 hypothetical protein J8273_8722 [Carpediemonas membranifera]
KAG9389433.1	KAG9389433.1 Adaptor Protein Complex 3 subunit, mu (AP3M) [Carpediemonas membranifera]
KAG9389434.1	KAG9389434.1 RNA recognition motif [Carpediemonas membranifera]
KAG9389435.1	KAG9389435.1 Rab-GTPase-TBC domain [Carpediemonas membranifera]
KAG9389436.1	KAG9389436.1 hypothetical protein J8273_8728 [Carpediemonas membranifera]
KAG9389437.1	KAG9389437.1 hypothetical protein J8273_8729 [Carpediemonas membranifera]
KAG9389438.1	KAG9389438.1 hypothetical protein J8273_8730 [Carpediemonas membranifera]
KAG9389439.1	KAG9389439.1 hypothetical protein J8273_8731 [Carpediemonas membranifera]
KAG9389440.1	KAG9389440.1 hypothetical protein J8273_8732 [Carpediemonas membranifera]
KAG9389441.1	KAG9389441.1 hypothetical protein J8273_8733 [Carpediemonas membranifera]
KAG9389442.1	KAG9389442.1 hypothetical protein J8273_8734 [Carpediemonas membranifera]
KAG9389443.1	KAG9389443.1 hypothetical protein J8273_8735 [Carpediemonas membranifera]
KAG9389444.1	KAG9389444.1 hypothetical protein J8273_8736 [Carpediemonas membranifera]
KAG9389445.1	KAG9389445.1 hypothetical protein J8273_8737 [Carpediemonas membranifera]
KAG9389446.1	KAG9389446.1 hypothetical protein J8273_8738 [Carpediemonas membranifera]
KAG9389447.1	KAG9389447.1 hypothetical protein J8273_8739 [Carpediemonas membranifera]
KAG9389448.1	KAG9389448.1 hypothetical protein J8273_8740 [Carpediemonas membranifera]
KAG9389449.1	KAG9389449.1 hypothetical protein J8273_8741 [Carpediemonas membranifera]
KAG9389450.1	KAG9389450.1 hypothetical protein J8273_8742 [Carpediemonas membranifera]
KAG9389451.1	KAG9389451.1 hypothetical protein J8273_8743 [Carpediemonas membranifera]
KAG9389452.1	KAG9389452.1 Zinc finger FYVE/FYVE-related type [Carpediemonas membranifera]
KAG9389453.1	KAG9389453.1 hypothetical protein J8273_8745 [Carpediemonas membranifera]
KAG9389454.1	KAG9389454.1 Eukaryotic translation initiation factor eIF2A [Carpediemonas membranifera]
KAG9389455.1	KAG9389455.1 Tubulin-tyrosine ligase/Tubulin polyglutamylase [Carpediemonas membranifera]
KAG9389456.1	KAG9389456.1 PAP2 superfamily [Carpediemonas membranifera]
KAG9389457.1	KAG9389457.1 Homeobox domain [Carpediemonas membranifera]
KAG9389458.1	KAG9389458.1 Spt4/RpoE2 zinc finger [Carpediemonas membranifera]
KAG9389459.1	KAG9389459.1 Spt4/RpoE2 zinc finger [Carpediemonas membranifera]
KAG9389460.1	KAG9389460.1 Pseudouridine-5'-phosphate glycosidase [Carpediemonas membranifera]
KAG9389461.1	KAG9389461.1 hypothetical protein J8273_8753 [Carpediemonas membranifera]
KAG9389462.1	KAG9389462.1 hypothetical protein J8273_8754 [Carpediemonas membranifera]
KAG9389463.1	KAG9389463.1 B41 domain-containing protein [Carpediemonas membranifera]
KAG9389464.1	KAG9389464.1 hypothetical protein J8273_8756 [Carpediemonas membranifera]
KAG9389465.1	KAG9389465.1 hypothetical protein J8273_8757 [Carpediemonas membranifera]
KAG9389466.1	KAG9389466.1 bis(5'-adenosyl)-triphosphatase [Carpediemonas membranifera]
KAG9389467.1	KAG9389467.1 hypothetical protein J8273_8759 [Carpediemonas membranifera]
KAG9389468.1	KAG9389468.1 Protein transport protein SEC31 [Carpediemonas membranifera]
KAG9389469.1	KAG9389469.1 phosphotyrosine-binding domain protein [Carpediemonas membranifera]
KAG9389470.1	KAG9389470.1 swarming motility protein YbiA [Carpediemonas membranifera]
KAG9389471.1	KAG9389471.1 TPR repeat [Carpediemonas membranifera]
KAG9389472.1	KAG9389472.1 Villin/Gelsolin [Carpediemonas membranifera]
KAG9389473.1	KAG9389473.1 FG-GAP repeat [Carpediemonas membranifera]
KAG9389474.1	KAG9389474.1 Protein of unknown function DUF229 [Carpediemonas membranifera]
KAG9389475.1	KAG9389475.1 hypothetical protein J8273_8767 [Carpediemonas membranifera]
KAG9389476.1	KAG9389476.1 hypothetical protein J8273_8768 [Carpediemonas membranifera]
KAG9389477.1	KAG9389477.1 Major facilitator superfamily (MFS) [Carpediemonas membranifera]
KAG9389478.1	KAG9389478.1 6-phosphogluconate dehydrogenase, decarboxylating [Carpediemonas membranifera]
KAG9389479.1	KAG9389479.1 glucose-6-phosphate dehydrogenase [Carpediemonas membranifera]
KAG9389480.1	KAG9389480.1 hypothetical protein J8273_8772 [Carpediemonas membranifera]
KAG9389481.1	KAG9389481.1 Rhomboid family [Carpediemonas membranifera]
KAG9389482.1	KAG9389482.1 hypothetical protein J8273_8774 [Carpediemonas membranifera]
KAG9389483.1	KAG9389483.1 Ring finger domain [Carpediemonas membranifera]
KAG9389484.1	KAG9389484.1 histidine-type phosphatase [Carpediemonas membranifera]
KAG9389485.1	KAG9389485.1 DNA topoisomerase 1 [Carpediemonas membranifera]
KAG9389486.1	KAG9389486.1 hypothetical protein J8273_8778 [Carpediemonas membranifera]
KAG9389487.1	KAG9389487.1 PROCN (NUC071) domain [Carpediemonas membranifera]
KAG9389488.1	KAG9389488.1 serine/threonine-protein kinase ATR [Carpediemonas membranifera]
KAG9389489.1	KAG9389489.1 Serine/threonine-protein kinase ATR [Carpediemonas membranifera]
KAG9389490.1	KAG9389490.1 Chromosome partition protein Smc [Carpediemonas membranifera]
KAG9389491.1	KAG9389491.1 hypothetical protein J8273_8783 [Carpediemonas membranifera]
KAG9389492.1	KAG9389492.1 Glycerol dehydrogenase [Carpediemonas membranifera]
KAG9389493.1	KAG9389493.1 hypothetical protein J8273_8785 [Carpediemonas membranifera]
KAG9389494.1	KAG9389494.1 hypothetical protein J8273_8786 [Carpediemonas membranifera]
KAG9389495.1	KAG9389495.1 Protein phosphatase methylesterase 1-like [Carpediemonas membranifera]
KAG9389496.1	KAG9389496.1 Pyruvate kinase [Carpediemonas membranifera]
KAG9389497.1	KAG9389497.1 hypothetical protein J8273_8789 [Carpediemonas membranifera]
KAG9389498.1	KAG9389498.1 hypothetical protein J8273_8790 [Carpediemonas membranifera]
KAG9389499.1	KAG9389499.1 hypothetical protein J8273_8791 [Carpediemonas membranifera]
KAG9389500.1	KAG9389500.1 hypothetical protein J8273_8792 [Carpediemonas membranifera]
KAG9389501.1	KAG9389501.1 hypothetical protein J8273_8793 [Carpediemonas membranifera]
KAG9389502.1	KAG9389502.1 Serine/threonine-protein kinase [Carpediemonas membranifera]
KAG9389503.1	KAG9389503.1 hypothetical protein J8273_8796 [Carpediemonas membranifera]
KAG9389504.1	KAG9389504.1 hypothetical protein J8273_8797 [Carpediemonas membranifera]
KAG9389505.1	KAG9389505.1 hypothetical protein J8273_8798 [Carpediemonas membranifera]
KAG9389506.1	KAG9389506.1 Replication factor-A, RFA1 [Carpediemonas membranifera]
KAG9389507.1	KAG9389507.1 chromosome condensation regulator RCC1 [Carpediemonas membranifera]
KAG9389508.1	KAG9389508.1 hypothetical protein J8273_8801 [Carpediemonas membranifera]
KAG9389509.1	KAG9389509.1 Protein kinase domain [Carpediemonas membranifera]
KAG9389510.1	KAG9389510.1 Soluble NSF attachment protein, SNAP [Carpediemonas membranifera]
KAG9389511.1	KAG9389511.1 WD domain, G-beta repeat [Carpediemonas membranifera]
KAG9389512.1	KAG9389512.1 DAD/Ost2 [Carpediemonas membranifera]
KAG9389513.1	KAG9389513.1 Dynein light chain, type 1/2 [Carpediemonas membranifera]
KAG9389514.1	KAG9389514.1 Phosphorylase superfamily [Carpediemonas membranifera]
KAG9389515.1	KAG9389515.1 hypothetical protein J8273_8808 [Carpediemonas membranifera]
KAG9389516.1	KAG9389516.1 Protein kinase domain [Carpediemonas membranifera]
KAG9389517.1	KAG9389517.1 WD domain, G-beta repeat [Carpediemonas membranifera]
KAG9389518.1	KAG9389518.1 FAD-dependent pyridine nucleotide-disulfide oxidoreductase [Carpediemonas membranifera]
KAG9389519.1	KAG9389519.1 Helicase associated domain (HA2) [Carpediemonas membranifera]
KAG9389520.1	KAG9389520.1 Dynamitin [Carpediemonas membranifera]
KAG9389521.1	KAG9389521.1 Glucose/ribitol dehydrogenase [Carpediemonas membranifera]
KAG9389522.1	KAG9389522.1 5'-nucleotidase [Carpediemonas membranifera]
KAG9389523.1	KAG9389523.1 hypothetical protein J8273_8816 [Carpediemonas membranifera]
KAG9389524.1	KAG9389524.1 Conserved hypothetical protein CHP02452 [Carpediemonas membranifera]
KAG9389525.1	KAG9389525.1 hypothetical protein J8273_8818 [Carpediemonas membranifera]
KAG9389526.1	KAG9389526.1 AMMECR1 [Carpediemonas membranifera]
KAG9389527.1	KAG9389527.1 Chromosome partition protein Smc [Carpediemonas membranifera]
KAG9389528.1	KAG9389528.1 hypothetical protein J8273_8821 [Carpediemonas membranifera]
KAG9389529.1	KAG9389529.1 hypothetical protein J8273_8822 [Carpediemonas membranifera]
KAG9389530.1	KAG9389530.1 hypothetical protein J8273_8823 [Carpediemonas membranifera]
KAG9389531.1	KAG9389531.1 hypothetical protein J8273_8824 [Carpediemonas membranifera]
KAG9389532.1	KAG9389532.1 hypothetical protein J8273_8825 [Carpediemonas membranifera]
KAG9389533.1	KAG9389533.1 hypothetical protein J8273_8826 [Carpediemonas membranifera]
KAG9389534.1	KAG9389534.1 hypothetical protein J8273_8827 [Carpediemonas membranifera]
KAG9389535.1	KAG9389535.1 Dynein heavy chain, N-terminal region 2 [Carpediemonas membranifera]
KAG9389536.1	KAG9389536.1 ABC transporter substrate-binding protein [Carpediemonas membranifera]
KAG9389537.1	KAG9389537.1 Uracyl-DNA glycosylase, UNG [Carpediemonas membranifera]
KAG9389538.1	KAG9389538.1 Ubiquitin-2 like Rad60 SUMO-like [Carpediemonas membranifera]
KAG9389539.1	KAG9389539.1 4Fe-4S Ferredoxin [Carpediemonas membranifera]
KAG9389540.1	KAG9389540.1 Protein tyrosine kinase [Carpediemonas membranifera]
KAG9389541.1	KAG9389541.1 hypothetical protein J8273_8834 [Carpediemonas membranifera]
KAG9389542.1	KAG9389542.1 Pyruvate flavodoxin oxidoreductase [Carpediemonas membranifera]
KAG9389543.1	KAG9389543.1 RNA polymerase II subunit A [Carpediemonas membranifera]
KAG9389544.1	KAG9389544.1 hypothetical protein J8273_8837 [Carpediemonas membranifera]
KAG9389545.1	KAG9389545.1 N-terminal region of Chorein, a TM vesicle-mediated sorter [Carpediemonas membranifera]
KAG9389546.1	KAG9389546.1 putative apicomplexan-conserved protein [Carpediemonas membranifera]
KAG9389547.1	KAG9389547.1 Ribosomal protein S2 [Carpediemonas membranifera]
KAG9389548.1	KAG9389548.1 Redoxin [Carpediemonas membranifera]
KAG9389549.1	KAG9389549.1 PPPDE putative peptidase domain [Carpediemonas membranifera]
KAG9389550.1	KAG9389550.1 hypothetical protein J8273_8843 [Carpediemonas membranifera]
KAG9389551.1	KAG9389551.1 hypothetical protein J8273_8844 [Carpediemonas membranifera]
KAG9389552.1	KAG9389552.1 Acetate [Carpediemonas membranifera]
KAG9389553.1	KAG9389553.1 Protein tyrosine kinase [Carpediemonas membranifera]
KAG9389554.1	KAG9389554.1 RAD50 [Carpediemonas membranifera]
KAG9389555.1	KAG9389555.1 hypothetical protein J8273_8848 [Carpediemonas membranifera]
KAG9389556.1	KAG9389556.1 tubulin gamma chain [Carpediemonas membranifera]
KAG9389557.1	KAG9389557.1 hypothetical protein J8273_8850 [Carpediemonas membranifera]
KAG9389558.1	KAG9389558.1 hypothetical protein J8273_8851 [Carpediemonas membranifera]
KAG9389559.1	KAG9389559.1 hypothetical protein J8273_8852 [Carpediemonas membranifera]
KAG9389560.1	KAG9389560.1 hypothetical protein J8273_8853 [Carpediemonas membranifera]
KAG9389561.1	KAG9389561.1 hypothetical protein J8273_8854 [Carpediemonas membranifera]
KAG9389562.1	KAG9389562.1 WD domain, G-beta repeat [Carpediemonas membranifera]
KAG9389563.1	KAG9389563.1 sulfurtransferase [Carpediemonas membranifera]
KAG9389564.1	KAG9389564.1 Leucine rich repeat [Carpediemonas membranifera]
KAG9389565.1	KAG9389565.1 hypothetical protein J8273_8858 [Carpediemonas membranifera]
KAG9389566.1	KAG9389566.1 putative zinc finger motif, C2HC5-type [Carpediemonas membranifera]
KAG9389567.1	KAG9389567.1 SNARE associated Golgi protein [Carpediemonas membranifera]
KAG9389568.1	KAG9389568.1 Thioredoxin [Carpediemonas membranifera]
KAG9389569.1	KAG9389569.1 hypothetical protein J8273_8862 [Carpediemonas membranifera]
KAG9389570.1	KAG9389570.1 Histidine kinase-, DNA gyrase B-, and HSP90-like ATPase [Carpediemonas membranifera]
KAG9389571.1	KAG9389571.1 Carbon-nitrogen hydrolase [Carpediemonas membranifera]
KAG9389572.1	KAG9389572.1 Protein kinase domain [Carpediemonas membranifera]
KAG9389573.1	KAG9389573.1 hypothetical protein J8273_8866 [Carpediemonas membranifera]
KAG9389574.1	KAG9389574.1 hypothetical protein J8273_8867 [Carpediemonas membranifera]
KAG9389575.1	KAG9389575.1 hypothetical protein J8273_8868 [Carpediemonas membranifera]
KAG9389576.1	KAG9389576.1 putative wd repeat domain phosphoinositide-interacting protein 2 protein [Carpediemonas membranifera]
KAG9389577.1	KAG9389577.1 hypothetical protein J8273_8870 [Carpediemonas membranifera]
KAG9389578.1	KAG9389578.1 long chain acylcoA synthetase [Carpediemonas membranifera]
KAG9389579.1	KAG9389579.1 COPII coat complex component Sec13, B (Sec13B) [Carpediemonas membranifera]
KAG9389580.1	KAG9389580.1 hypothetical protein J8273_8873 [Carpediemonas membranifera]
KAG9389581.1	KAG9389581.1 Programmed cell death protein 2, C-terminal putative domain [Carpediemonas membranifera]
KAG9389582.1	KAG9389582.1 Brix domain [Carpediemonas membranifera]
KAG9389583.1	KAG9389583.1 Chromosome partition protein Smc [Carpediemonas membranifera]
KAG9389584.1	KAG9389584.1 hypothetical protein J8273_8877 [Carpediemonas membranifera]
KAG9389585.1	KAG9389585.1 methionine--tRNA ligase [Carpediemonas membranifera]
KAG9389586.1	KAG9389586.1 Snf7/Vps24/ESCRT-III family [Carpediemonas membranifera]
KAG9389587.1	KAG9389587.1 Phosphoserine aminotransferase [Carpediemonas membranifera]
KAG9389588.1	KAG9389588.1 Dynein heavy chain, N-terminal region 1 [Carpediemonas membranifera]
KAG9389589.1	KAG9389589.1 B9 domain [Carpediemonas membranifera]
KAG9389590.1	KAG9389590.1 hypothetical protein J8273_8883 [Carpediemonas membranifera]
KAG9389591.1	KAG9389591.1 Ubiquitin family [Carpediemonas membranifera]
KAG9389592.1	KAG9389592.1 hypothetical protein J8273_8885 [Carpediemonas membranifera]
KAG9389593.1	KAG9389593.1 HEAT repeat [Carpediemonas membranifera]
KAG9389594.1	KAG9389594.1 Ornithine/DAP/Arg decarboxylase [Carpediemonas membranifera]
KAG9389595.1	KAG9389595.1 Chromosome partition protein Smc [Carpediemonas membranifera]
KAG9389596.1	KAG9389596.1 Calcineurin-like phosphoesterase [Carpediemonas membranifera]
KAG9389597.1	KAG9389597.1 hypothetical protein J8273_8890 [Carpediemonas membranifera]
KAG9389598.1	KAG9389598.1 SNARE domain [Carpediemonas membranifera]
KAG9389599.1	KAG9389599.1 Fructose-bisphosphate aldolase, class-I [Carpediemonas membranifera]
KAG9389600.1	KAG9389600.1 hypothetical protein J8273_8893 [Carpediemonas membranifera]
KAG9389601.1	KAG9389601.1 YhhN-like [Carpediemonas membranifera]
KAG9389602.1	KAG9389602.1 hypothetical protein J8273_8895 [Carpediemonas membranifera]
KAG9389603.1	KAG9389603.1 Ribosomal protein S5, eukaryotic/archaeal [Carpediemonas membranifera]
KAG9389604.1	KAG9389604.1 hypothetical protein J8273_8897 [Carpediemonas membranifera]
KAG9389605.1	KAG9389605.1 Lysophospholipid acyltransferase [Carpediemonas membranifera]
KAG9389606.1	KAG9389606.1 Ubiquitin-protein ligase E3A [Carpediemonas membranifera]
KAG9389607.1	KAG9389607.1 sulfite exporter TauE/SafE family protein [Carpediemonas membranifera]
KAG9389608.1	KAG9389608.1 5'-methylthioadenosine/S-adenosylhomocysteine nucleosidase [Carpediemonas membranifera]
KAG9389609.1	KAG9389609.1 hypothetical protein J8273_8902 [Carpediemonas membranifera]
KAG9389610.1	KAG9389610.1 SFI1 [Carpediemonas membranifera]
KAG9389611.1	KAG9389611.1 Ubiquitin--protein ligase [Carpediemonas membranifera]
KAG9389612.1	KAG9389612.1 hypothetical protein J8273_8905 [Carpediemonas membranifera]
KAG9389613.1	KAG9389613.1 5'-nucleotidase, C-terminal domain [Carpediemonas membranifera]
KAG9389614.1	KAG9389614.1 Replication factor C small subunit, RFC3 [Carpediemonas membranifera]
KAG9389615.1	KAG9389615.1 hypothetical protein J8273_8908 [Carpediemonas membranifera]
KAG9389616.1	KAG9389616.1 hypothetical protein J8273_8909 [Carpediemonas membranifera]
KAG9389617.1	KAG9389617.1 Maf1 regulator [Carpediemonas membranifera]
KAG9389618.1	KAG9389618.1 hypothetical protein J8273_8911 [Carpediemonas membranifera]
KAG9389619.1	KAG9389619.1 TANDEM PH DOMAIN CONTAINING PROTEIN [Carpediemonas membranifera]
KAG9389620.1	KAG9389620.1 cell differentiation protein RCD1 [Carpediemonas membranifera]
KAG9389621.1	KAG9389621.1 U3 small nucleolar RNA-associated protein 25 [Carpediemonas membranifera]
KAG9389622.1	KAG9389622.1 U3 small nucleolar RNA-interacting protein [Carpediemonas membranifera]
KAG9389623.1	KAG9389623.1 Ras-related protein Rab-28 [Carpediemonas membranifera]
KAG9389624.1	KAG9389624.1 nucleotide exchange factor GrpE [Carpediemonas membranifera]
KAG9389625.1	KAG9389625.1 hypothetical protein J8273_8918 [Carpediemonas membranifera]
KAG9389626.1	KAG9389626.1 Cyclin, N-terminal domain [Carpediemonas membranifera]
KAG9389627.1	KAG9389627.1 hypothetical protein J8273_8920 [Carpediemonas membranifera]
KAG9389628.1	KAG9389628.1 hypothetical protein J8273_8922 [Carpediemonas membranifera]
KAG9389629.1	KAG9389629.1 hypothetical protein J8273_8925 [Carpediemonas membranifera]
KAG9389630.1	KAG9389630.1 Zinc finger CCHC-type [Carpediemonas membranifera]
KAG9389631.1	KAG9389631.1 UAA transporter [Carpediemonas membranifera]
KAG9389632.1	KAG9389632.1 ATPase, V1 complex, subunit D [Carpediemonas membranifera]
KAG9389633.1	KAG9389633.1 hypothetical protein J8273_8932 [Carpediemonas membranifera]
KAG9389634.1	KAG9389634.1 Chromosome partition protein Smc [Carpediemonas membranifera]
KAG9389635.1	KAG9389635.1 Actin-related protein [Carpediemonas membranifera]
KAG9389636.1	KAG9389636.1 Tetratricopeptide repeat [Carpediemonas membranifera]
KAG9389637.1	KAG9389637.1 Golgi-body localization protein domain [Carpediemonas membranifera]
KAG9389638.1	KAG9389638.1 Leucine Rich Repeat [Carpediemonas membranifera]
KAG9389639.1	KAG9389639.1 hypothetical protein J8273_8938 [Carpediemonas membranifera]
KAG9389640.1	KAG9389640.1 Protein of unknown function (DUF663) [Carpediemonas membranifera]
KAG9389641.1	KAG9389641.1 Glutathione synthase, eukaryotic [Carpediemonas membranifera]
KAG9389642.1	KAG9389642.1 WH2 motif [Carpediemonas membranifera]
KAG9389643.1	KAG9389643.1 hypothetical protein J8273_8942 [Carpediemonas membranifera]
KAG9389644.1	KAG9389644.1 Serine/threonine-protein kinase [Carpediemonas membranifera]
KAG9389645.1	KAG9389645.1 tRNA transferase Trm5/Tyw2 [Carpediemonas membranifera]
KAG9389646.1	KAG9389646.1 Phenylalanyl-tRNA synthetase, class IIc, alpha subunit [Carpediemonas membranifera]
KAG9389647.1	KAG9389647.1 hypothetical protein J8273_8946 [Carpediemonas membranifera]
KAG9389648.1	KAG9389648.1 hypothetical protein J8273_8947 [Carpediemonas membranifera]
KAG9389649.1	KAG9389649.1 beta-tubulin [Carpediemonas membranifera]
KAG9389650.1	KAG9389650.1 Conserved hypothetical protein CHP02452 [Carpediemonas membranifera]
KAG9389651.1	KAG9389651.1 Iron superoxide dismutase [Carpediemonas membranifera]
KAG9389652.1	KAG9389652.1 Protein phosphatase 2A, regulatory B subunit, B56 [Carpediemonas membranifera]
KAG9389653.1	KAG9389653.1 hypothetical protein J8273_8952 [Carpediemonas membranifera]
KAG9389654.1	KAG9389654.1 Myb-like DNA-binding domain [Carpediemonas membranifera]
KAG9389655.1	KAG9389655.1 chromosome segregation protein [Carpediemonas membranifera]
KAG9389656.1	KAG9389656.1 Small GTPase superfamily [Carpediemonas membranifera]
KAG9389657.1	KAG9389657.1 Zinc knuckle [Carpediemonas membranifera]
KAG9389658.1	KAG9389658.1 hypothetical protein J8273_8958 [Carpediemonas membranifera]
KAG9389659.1	KAG9389659.1 Coatomer WD associated region [Carpediemonas membranifera]
KAG9389660.1	KAG9389660.1 Phosphoribosyl transferase domain [Carpediemonas membranifera]
KAG9389661.1	KAG9389661.1 Nucleoside diphosphate kinase [Carpediemonas membranifera]
KAG9389662.1	KAG9389662.1 hypothetical protein J8273_8962 [Carpediemonas membranifera]
KAG9389663.1	KAG9389663.1 putative ferric reductase [Carpediemonas membranifera]
KAG9389664.1	KAG9389664.1 Adenine phosphoribosyl transferase [Carpediemonas membranifera]
KAG9389665.1	KAG9389665.1 hypothetical protein J8273_8965 [Carpediemonas membranifera]
KAG9389666.1	KAG9389666.1 hypothetical protein J8273_8966 [Carpediemonas membranifera]
KAG9389667.1	KAG9389667.1 Ubiquitin-conjugating enzyme [Carpediemonas membranifera]
KAG9389668.1	KAG9389668.1 Trp-Asp (WD) repeats circular [Carpediemonas membranifera]
KAG9389669.1	KAG9389669.1 hypothetical protein J8273_8969 [Carpediemonas membranifera]
KAG9389670.1	KAG9389670.1 WD domain, G-beta repeat [Carpediemonas membranifera]
KAG9389671.1	KAG9389671.1 hypothetical protein J8273_8971 [Carpediemonas membranifera]
KAG9389672.1	KAG9389672.1 hypothetical protein J8273_8972 [Carpediemonas membranifera]
KAG9389673.1	KAG9389673.1 Uncharacterized protein family UPF0047 [Carpediemonas membranifera]
KAG9389674.1	KAG9389674.1 hypothetical protein J8273_8974 [Carpediemonas membranifera]
KAG9389675.1	KAG9389675.1 hypothetical protein J8273_8975 [Carpediemonas membranifera]
KAG9389676.1	KAG9389676.1 hypothetical protein J8273_8976 [Carpediemonas membranifera]
KAG9389677.1	KAG9389677.1 hypothetical protein J8273_8977 [Carpediemonas membranifera]
KAG9389678.1	KAG9389678.1 Chromo and chromo shadow domain [Carpediemonas membranifera]
KAG9389679.1	KAG9389679.1 hypothetical protein J8273_8980 [Carpediemonas membranifera]
KAG9389680.1	KAG9389680.1 hypothetical protein J8273_8981 [Carpediemonas membranifera]
KAG9389681.1	KAG9389681.1 hypothetical protein J8273_8985 [Carpediemonas membranifera]
KAG9389682.1	KAG9389682.1 histone H3/CENP-A [Carpediemonas membranifera]
KAG9389683.1	KAG9389683.1 hypothetical protein J8273_8987 [Carpediemonas membranifera]
KAG9389684.1	KAG9389684.1 hypothetical protein J8273_8988 [Carpediemonas membranifera]
KAG9389685.1	KAG9389685.1 hypothetical protein J8273_8989 [Carpediemonas membranifera]
KAG9389686.1	KAG9389686.1 hypothetical protein J8273_8990 [Carpediemonas membranifera]
KAG9389687.1	KAG9389687.1 hypothetical protein J8273_8991 [Carpediemonas membranifera]
KAG9389688.1	KAG9389688.1 hypothetical protein J8273_8992 [Carpediemonas membranifera]
KAG9389689.1	KAG9389689.1 hypothetical protein J8273_8993 [Carpediemonas membranifera]
KAG9389690.1	KAG9389690.1 PH domain containing protein, partial [Carpediemonas membranifera]
KAG9389691.1	KAG9389691.1 cyclin dependent kinase [Carpediemonas membranifera]
KAG9389692.1	KAG9389692.1 replication factor C subunit 5 [Carpediemonas membranifera]
KAG9389693.1	KAG9389693.1 Protein of unknown function DUF2373 [Carpediemonas membranifera]
KAG9389694.1	KAG9389694.1 hypothetical protein J8273_8368 [Carpediemonas membranifera]
KAG9389695.1	KAG9389695.1 hypothetical protein J8273_8369 [Carpediemonas membranifera]
KAG9389696.1	KAG9389696.1 hypothetical protein J8273_8370 [Carpediemonas membranifera]
KAG9389697.1	KAG9389697.1 hypothetical protein J8273_8371 [Carpediemonas membranifera]
KAG9389698.1	KAG9389698.1 hypothetical protein J8273_8372 [Carpediemonas membranifera]
KAG9389699.1	KAG9389699.1 Chromosome partition protein Smc [Carpediemonas membranifera]
KAG9389700.1	KAG9389700.1 DNA topoisomerase 2 alpha [Carpediemonas membranifera]
KAG9389701.1	KAG9389701.1 WD domain G-beta repeat [Carpediemonas membranifera]
KAG9389702.1	KAG9389702.1 Pyridoxal-phosphate dependent enzyme [Carpediemonas membranifera]
KAG9389703.1	KAG9389703.1 Serine/Threonine kinase ATM [Carpediemonas membranifera]
KAG9389704.1	KAG9389704.1 NLI interacting factor-like phosphatase [Carpediemonas membranifera]
KAG9389705.1	KAG9389705.1 hypothetical protein J8273_8379 [Carpediemonas membranifera]
KAG9389706.1	KAG9389706.1 Dynein heavy chain N-terminal region 2 [Carpediemonas membranifera]
KAG9389707.1	KAG9389707.1 Aldehyde oxidase/xanthine dehydrogenase [Carpediemonas membranifera]
KAG9389708.1	KAG9389708.1 MORN repeat [Carpediemonas membranifera]
KAG9389709.1	KAG9389709.1 Acyltransferase [Carpediemonas membranifera]
KAG9389710.1	KAG9389710.1 hypothetical protein J8273_8384 [Carpediemonas membranifera]
KAG9389711.1	KAG9389711.1 Arb2 domain [Carpediemonas membranifera]
KAG9389712.1	KAG9389712.1 XdhC Rossmann domain [Carpediemonas membranifera]
KAG9389713.1	KAG9389713.1 hypothetical protein J8273_8387 [Carpediemonas membranifera]
KAG9389714.1	KAG9389714.1 Ribosomal protein L6 [Carpediemonas membranifera]
KAG9389715.1	KAG9389715.1 hypothetical protein J8273_8389 [Carpediemonas membranifera]
KAG9389716.1	KAG9389716.1 hypothetical protein J8273_8390 [Carpediemonas membranifera]
KAG9389717.1	KAG9389717.1 regulator of chromosome condensation (RCC1) repeat family protein [Carpediemonas membranifera]
KAG9389718.1	KAG9389718.1 hypothetical protein J8273_8392 [Carpediemonas membranifera]
KAG9389719.1	KAG9389719.1 Adaptor Protein Complex 2 subunit sigma (AP2S2) [Carpediemonas membranifera]
KAG9389720.1	KAG9389720.1 Ubiquitin-conjugating enzyme [Carpediemonas membranifera]
KAG9389721.1	KAG9389721.1 hypothetical protein J8273_8395 [Carpediemonas membranifera]
KAG9389722.1	KAG9389722.1 hypothetical protein J8273_8396 [Carpediemonas membranifera]
KAG9389723.1	KAG9389723.1 hypothetical protein J8273_8397 [Carpediemonas membranifera]
KAG9389724.1	KAG9389724.1 tetrovirus-related pol polyprotein [Carpediemonas membranifera]
KAG9389725.1	KAG9389725.1 Vacuolar Protein Sorting 35 (VPS35) [Carpediemonas membranifera]
KAG9389726.1	KAG9389726.1 COPII coat complex component Sec24 E (Sec24E) [Carpediemonas membranifera]
KAG9389727.1	KAG9389727.1 Sec23/Sec24 trunk domain [Carpediemonas membranifera]
KAG9389728.1	KAG9389728.1 hypothetical protein J8273_8402 [Carpediemonas membranifera]
KAG9389729.1	KAG9389729.1 hypothetical protein J8273_8403 [Carpediemonas membranifera]
